doi,title,journal,year,decision,source,decision_source,last_updated
10.1371/journal.pone.0080673,complete mitochondrial dna diversity in iranians,PLoS ONE,2013.0,no,legacy_lab_table,legacy_lab_table,2025-11-25
10.1371/journal.pone.0076600,semantics syntax or neither a case for resolution in the interpretation of n500 and p600 responses to harmonic incongruities,PLoS ONE,2013.0,no,legacy_lab_table,legacy_lab_table,2025-11-25
10.1371/journal.pone.0073623,all that glitters isnt gold a survey on acknowledgment of limitations in biomedical studies,PLoS ONE,2013.0,no,legacy_lab_table,legacy_lab_table,2025-11-25
10.1371/journal.pone.0077040,framing political messages to fit the audiences regulatory orientation how to improve the efficacy of the same message content,PLoS ONE,2013.0,no,legacy_lab_table,legacy_lab_table,2025-11-25
10.1371/journal.pone.0074952,an fmri study of grammatical morpheme processing associated with nouns and verbs in chinese,PLoS ONE,2013.0,no,legacy_lab_table,legacy_lab_table,2025-11-25
10.1371/journal.pone.0075183,the motor system contributes to comprehension of abstract language,PLoS ONE,2013.0,no,legacy_lab_table,legacy_lab_table,2025-11-25
10.1371/journal.pone.0074061,the effect of font size on reading comprehension on second and fifth grade children bigger is not always better,PLoS ONE,2013.0,no,legacy_lab_table,legacy_lab_table,2025-11-25
10.1371/journal.pone.0072357,entangled parametric hierarchies problems for an overspecified universal grammar,PLoS ONE,2013.0,no,legacy_lab_table,legacy_lab_table,2025-11-25
10.1371/journal.pone.0069185,identifying issue frames in text,PLoS ONE,2013.0,no,legacy_lab_table,legacy_lab_table,2025-11-25
10.1371/journal.pone.0066499,uniparental genetic heritage of belarusians encounter of rare middle eastern matrilineages with a central european mitochondrial dna pool,PLoS ONE,2013.0,no,legacy_lab_table,legacy_lab_table,2025-11-25
10.1371/journal.pone.0066100,environmental sounds recognition in children with cochlear implants,PLoS ONE,2013.0,no,legacy_lab_table,legacy_lab_table,2025-11-25
10.1371/journal.pone.0061519,google matrix analysis of dna sequences,PLoS ONE,2013.0,no,legacy_lab_table,legacy_lab_table,2025-11-25
10.1371/journal.pone.0061402,do parentese prosody and fathers involvement in interacting facilitate social interaction in infants who later develop autism,PLoS ONE,2013.0,no,legacy_lab_table,legacy_lab_table,2025-11-25
10.1371/journal.pone.0056000,speech rhythm facilitates syntactic ambiguity resolution erp evidence,PLoS ONE,2013.0,no,legacy_lab_table,legacy_lab_table,2025-11-25
10.1371/journal.pone.0059103,familial sinistrals avoid exact numbers,PLoS ONE,2013.0,no,legacy_lab_table,legacy_lab_table,2025-11-25
10.1371/journal.pone.0084444,parents accidentally substitute similar sounding sibling names more often than dissimilar names,PLoS ONE,2013.0,no,legacy_lab_table,legacy_lab_table,2025-11-25
10.1371/journal.pone.0072693,shared brain lateralization patterns in language and acheulean stone tool production a functional transcranial doppler ultrasound study,PLoS ONE,2013.0,no,legacy_lab_table,legacy_lab_table,2025-11-25
10.1371/journal.pone.0066813,language individuation and marker words shakespeare and his maxwells demon,PLoS ONE,2013.0,no,legacy_lab_table,legacy_lab_table,2025-11-25
10.1371/journal.pone.0071781,the cultural evolution of human communication systems in different sized populations usability trumps learnability,PLoS ONE,2013.0,no,legacy_lab_table,legacy_lab_table,2025-11-25
10.1371/journal.pone.0068178,morpheme matching based text tokenization for a scarce resourced language,PLoS ONE,2013.0,no,legacy_lab_table,legacy_lab_table,2025-11-25
10.1371/journal.pone.0065111,communicative versus strategic rationality habermas theory of communicative action and the social brain,PLoS ONE,2013.0,no,legacy_lab_table,legacy_lab_table,2025-11-25
10.1016/j.neuropsychologia.2012.05.016,automated semantic indices related to cognitive function and rate of cognitive decline,Neuropsychologia,2012.0,no,legacy_lab_table,legacy_lab_table,2025-11-25
10.1371/journal.pone.0041766,eye movements reveal effects of visual content on eye guidance and lexical access during reading,PLoS ONE,2012.0,no,legacy_lab_table,legacy_lab_table,2025-11-25
10.1371/journal.pone.0035932,unfolding visual lexical decision in time,PLoS ONE,2012.0,no,legacy_lab_table,legacy_lab_table,2025-11-25
10.1371/journal.pone.0030027,preattentive extraction of abstract auditory rules in speech sound stream a mismatch negativity study using lexical tones,PLoS ONE,2012.0,no,legacy_lab_table,legacy_lab_table,2025-11-25
10.1371/journal.pone.0034243,the derived allele of aspm is associated with lexical tone perception,PLoS ONE,2012.0,no,legacy_lab_table,legacy_lab_table,2025-11-25
10.1371/journal.pone.0044020,lexical references to sensory modalities in verbal descriptions of people and objects by congenitally blind late blind and sighted adults,PLoS ONE,2012.0,no,legacy_lab_table,legacy_lab_table,2025-11-25
10.1371/journal.pone.0036030,does the reading of different orthographies produce distinct brain activity patterns an erp study,PLoS ONE,2012.0,no,legacy_lab_table,legacy_lab_table,2025-11-25
10.1371/journal.pone.0046354,neural substrates for semantic memory of familiar songs is there an interface between lyrics and melodies,PLoS ONE,2012.0,no,legacy_lab_table,legacy_lab_table,2025-11-25
10.1371/journal.pone.0042829,subthalamic nucleus deep brain stimulation impacts language in early parkinsons disease,PLoS ONE,2012.0,no,legacy_lab_table,legacy_lab_table,2025-11-25
10.1371/journal.pone.0032809,priming picture naming with a semantic task an fmri investigation,PLoS ONE,2012.0,no,legacy_lab_table,legacy_lab_table,2025-11-25
10.1371/journal.pone.0046922,the characteristics of chinese orthographic neighborhood size effect for developing readers,PLoS ONE,2012.0,no,legacy_lab_table,legacy_lab_table,2025-11-25
10.1371/journal.pone.0052826,from mind to mouth event related potentials of sentence production in classic galactosemia,PLoS ONE,2012.0,no,legacy_lab_table,legacy_lab_table,2025-11-25
10.1371/journal.pone.0047446,prosody discrimination by songbirds padda oryzivora,PLoS ONE,2012.0,no,legacy_lab_table,legacy_lab_table,2025-11-25
10.1371/journal.pone.0045636,letter position coding across modalities the case of braille readers,PLoS ONE,2012.0,no,legacy_lab_table,legacy_lab_table,2025-11-25
10.1371/journal.pone.0045091,argument structure and morphological factors in noun and verb processing an fmri study,PLoS ONE,2012.0,no,legacy_lab_table,legacy_lab_table,2025-11-25
10.1371/journal.pone.0038201,differences in brain function and changes with intervention in children with poor spelling and reading abilities,PLoS ONE,2012.0,no,legacy_lab_table,legacy_lab_table,2025-11-25
10.1371/journal.pone.0032121,deciphering captchas what a turing test reveals about human cognition,PLoS ONE,2012.0,no,legacy_lab_table,legacy_lab_table,2025-11-25
10.1371/journal.pone.0032377,spontaneous gender categorization in masking and priming studies key for distinguishing jane from john doe but not madonna from sinatra,PLoS ONE,2012.0,no,legacy_lab_table,legacy_lab_table,2025-11-25
10.1371/journal.pone.0033661,pitch enumeration failure to subitize in audition,PLoS ONE,2012.0,no,legacy_lab_table,legacy_lab_table,2025-11-25
10.1371/journal.pone.0048747,molecular epidemiology of human immunodeficiency virus type 1 in guangdong province of southern china,PLoS ONE,2012.0,no,legacy_lab_table,legacy_lab_table,2025-11-25
10.1371/journal.pone.0044602,dissociation of detection and discrimination of pure tones following bilateral lesions of auditory cortex,PLoS ONE,2012.0,no,legacy_lab_table,legacy_lab_table,2025-11-25
10.1371/journal.pone.0031001,emotional cues during simultaneous face and voice processing electrophysiological insights,PLoS ONE,2012.0,no,legacy_lab_table,legacy_lab_table,2025-11-25
10.1371/journal.pone.0051419,p3b reflects periodicity in linguistic sequences,PLoS ONE,2012.0,no,legacy_lab_table,legacy_lab_table,2025-11-25
10.1371/journal.pone.0030657,tracking down abstract linguistic meaning neural correlates of spatial frame of reference ambiguities in language,PLoS ONE,2012.0,no,legacy_lab_table,legacy_lab_table,2025-11-25
10.1371/journal.pone.0048029,the biological origin of linguistic diversity,PLoS ONE,2012.0,no,legacy_lab_table,legacy_lab_table,2025-11-25
10.1371/journal.pone.0027971,female fertility affects mens linguistic choices,PLoS ONE,2012.0,no,legacy_lab_table,legacy_lab_table,2025-11-25
10.1371/journal.pone.0050039,word decoding of protein amino acid sequences with availability analysis a linguistic approach,PLoS ONE,2012.0,no,legacy_lab_table,legacy_lab_table,2025-11-25
10.1371/journal.pone.0038236,interactive language learning by robots the transition from babbling to word forms,PLoS ONE,2012.0,no,legacy_lab_table,legacy_lab_table,2025-11-25
10.1371/journal.pone.0036154,out of mind out of sight language affects perceptual vividness in memory,PLoS ONE,2012.0,no,legacy_lab_table,legacy_lab_table,2025-11-25
10.1371/journal.pone.0033424,effects of culture on musical pitch perception,PLoS ONE,2012.0,no,legacy_lab_table,legacy_lab_table,2025-11-25
10.1371/journal.pone.0033202,phrase frequency effects in language production,PLoS ONE,2012.0,no,legacy_lab_table,legacy_lab_table,2025-11-25
10.1371/journal.pone.0041400,the heterogeneous hla genetic makeup of the swiss population,PLoS ONE,2012.0,no,legacy_lab_table,legacy_lab_table,2025-11-25
10.1371/journal.pone.0035025,cultural phylogenetics of the tupi language family in lowland south america,PLoS ONE,2012.0,no,legacy_lab_table,legacy_lab_table,2025-11-25
10.1371/journal.pone.0042256,measurement properties of questionnaires measuring continuity of care a systematic review,PLoS ONE,2012.0,no,legacy_lab_table,legacy_lab_table,2025-11-25
10.1371/journal.pone.0052064,investigating cultural evolution using phylogenetic analysis the origins and descent of the southeast asian tradition of warp ikat weaving,PLoS ONE,2012.0,no,legacy_lab_table,legacy_lab_table,2025-11-25
10.1371/journal.pone.0052194,frequency of educational computer use as a longitudinal predictor of educational outcome in young people with specific language impairment,PLoS ONE,2012.0,no,legacy_lab_table,legacy_lab_table,2025-11-25
10.1371/journal.pone.0050997,working memory is partially preserved during sleep,PLoS ONE,2012.0,no,legacy_lab_table,legacy_lab_table,2025-11-25
10.1371/journal.pone.0049228,your space or mine mapping self in time,PLoS ONE,2012.0,no,legacy_lab_table,legacy_lab_table,2025-11-25
10.1371/journal.pone.0043753,effects of speech clarity on recognition memory for spoken sentences,PLoS ONE,2012.0,no,legacy_lab_table,legacy_lab_table,2025-11-25
10.1371/journal.pone.0035757,leadership in orchestra emerges from the causal relationships of movement kinematics,PLoS ONE,2012.0,no,legacy_lab_table,legacy_lab_table,2025-11-25
10.1371/journal.pone.0035289,dating the origin of language using phonemic diversity,PLoS ONE,2012.0,no,legacy_lab_table,legacy_lab_table,2025-11-25
10.1371/journal.pone.0033718,how the emotional content of discourse affects language comprehension,PLoS ONE,2012.0,no,legacy_lab_table,legacy_lab_table,2025-11-25
10.1371/journal.pone.0032546,genetic affinities of the central indian tribal populations,PLoS ONE,2012.0,no,legacy_lab_table,legacy_lab_table,2025-11-25
10.1371/journal.pone.0029273,why levallois a morphometric comparison of experimental preferential levallois flakes versus debitage flakes,PLoS ONE,2012.0,no,legacy_lab_table,legacy_lab_table,2025-11-25
10.1371/journal.pone.0051471,animal detection precedes access to scene category,PLoS ONE,2012.0,no,legacy_lab_table,legacy_lab_table,2025-11-25
10.1371/journal.pone.0030182,vocabulary learning in a yorkshire terrier slow mapping of spoken words,PLoS ONE,2012.0,no,legacy_lab_table,legacy_lab_table,2025-11-25
10.1371/journal.pone.0044003,decoding reveals plasticity in v3a as a result of motion perceptual learning,PLoS ONE,2012.0,no,legacy_lab_table,legacy_lab_table,2025-11-25
10.1371/journal.pone.0030578,system dynamics to model the unintended consequences of denying payment for venous thromboembolism after total knee arthroplasty,PLoS ONE,2012.0,no,legacy_lab_table,legacy_lab_table,2025-11-25
10.1371/journal.pone.0031546,cognitive control reflects context monitoring not motoric stopping in response inhibition,PLoS ONE,2012.0,no,legacy_lab_table,legacy_lab_table,2025-11-25
10.1371/journal.pone.0019348,small worlds and semantic network growth in typical and late talkers,PLoS ONE,2011.0,no,legacy_lab_table,legacy_lab_table,2025-11-25
10.1371/journal.pone.0020109,on the accuracy of language trees,PLoS ONE,2011.0,no,legacy_lab_table,legacy_lab_table,2025-11-25
10.1371/journal.pone.0023613,quantitative social dialectology explaining linguistic variation geographically and socially,PLoS ONE,2011.0,no,legacy_lab_table,legacy_lab_table,2025-11-25
10.1371/journal.pone.0022651,modeling abnormal priming in alzheimers patients with a free association network,PLoS ONE,2011.0,no,legacy_lab_table,legacy_lab_table,2025-11-25
10.1371/journal.pone.0020963,cortical dynamics of acoustic and phonological processing in speech perception,PLoS ONE,2011.0,no,legacy_lab_table,legacy_lab_table,2025-11-25
10.1371/journal.pone.0020273,subliminal semantic priming in speech,PLoS ONE,2011.0,no,legacy_lab_table,legacy_lab_table,2025-11-25
10.1371/journal.pone.0018131,evaluating effects of divided hemispheric processing on word recognition in foveal and extrafoveal displays the evidence from arabic,PLoS ONE,2011.0,no,legacy_lab_table,legacy_lab_table,2025-11-25
10.1371/journal.pone.0021676,domestic dogs use contextual information and tone of voice when following a human pointing gesture,PLoS ONE,2011.0,no,legacy_lab_table,legacy_lab_table,2025-11-25
10.1371/journal.pone.0019875,universal entropy of word ordering across linguistic families,PLoS ONE,2011.0,no,legacy_lab_table,legacy_lab_table,2025-11-25
10.1371/journal.pone.0016227,predictions of native american population structure using linguistic covariates in a hidden regression framework,PLoS ONE,2011.0,no,legacy_lab_table,legacy_lab_table,2025-11-25
10.1371/journal.pone.0022341,swearing euphemisms and linguistic relativity,PLoS ONE,2011.0,no,legacy_lab_table,legacy_lab_table,2025-11-25
10.1371/journal.pone.0015988,reconstructing the indian origin and dispersal of the european roma a maternal genetic perspective,PLoS ONE,2011.0,no,legacy_lab_table,legacy_lab_table,2025-11-25
10.1371/journal.pone.0016677,aging in language dynamics,PLoS ONE,2011.0,no,legacy_lab_table,legacy_lab_table,2025-11-25
10.1371/journal.pone.0017577,interference between sentence processing and probabilistic implicit sequence learning,PLoS ONE,2011.0,no,legacy_lab_table,legacy_lab_table,2025-11-25
10.1371/journal.pone.0027105,reading text increases binocular disparity in dyslexic children,PLoS ONE,2011.0,no,legacy_lab_table,legacy_lab_table,2025-11-25
10.1371/journal.pone.0024672,hemispheric asymmetries in speech perception sense nonsense and modulations,PLoS ONE,2011.0,no,legacy_lab_table,legacy_lab_table,2025-11-25
10.1371/journal.pone.0022943,ethnicity and population structure in personal naming networks,PLoS ONE,2011.0,no,legacy_lab_table,legacy_lab_table,2025-11-25
10.1371/journal.pone.0016338,ancestry of the iban is predominantly southeast asian genetic evidence from autosomal mitochondrial and y chromosomes,PLoS ONE,2011.0,no,legacy_lab_table,legacy_lab_table,2025-11-25
10.1371/journal.pone.0027341,a map of copy number variations in chinese populations,PLoS ONE,2011.0,no,legacy_lab_table,legacy_lab_table,2025-11-25
10.1371/journal.pone.0025085,judgment of the humanness of an interlocutor is in the eye of the beholder,PLoS ONE,2011.0,no,legacy_lab_table,legacy_lab_table,2025-11-25
10.1371/journal.pone.0024253,spatial language processing in the blind evidence for a supramodal representation and cortical reorganization,PLoS ONE,2011.0,no,legacy_lab_table,legacy_lab_table,2025-11-25
10.1371/journal.pone.0022501,the enigma of number why children find the meanings of even small number words hard to learn and how we can help them do better,PLoS ONE,2011.0,no,legacy_lab_table,legacy_lab_table,2025-11-25
10.1371/journal.pone.0022058,evolutionary history of helicobacter pylori sequences reflect past human migrations in southeast asia,PLoS ONE,2011.0,no,legacy_lab_table,legacy_lab_table,2025-11-25
10.1371/journal.pone.0016701,facilitating stable representations serial dependence in vision,PLoS ONE,2011.0,no,legacy_lab_table,legacy_lab_table,2025-11-25
10.1016/j.linged.2010.11.009,linguistic norms and adult roles in play and serious frames,Linguistics and Education,2011.0,no,legacy_lab_table,legacy_lab_table,2025-11-25
10.1017/s0047404511000029,relative linguistic homogeneity in a new society the case of iceland,Language in Society,2011.0,no,legacy_lab_table,legacy_lab_table,2025-11-25
10.1371/journal.pone.0009892,erp characterization of sustained attention effects in visual lexical categorization,PLoS ONE,2010.0,no,legacy_lab_table,legacy_lab_table,2025-11-25
10.1371/journal.pone.0008559,language structure is partly determined by social structure,PLoS ONE,2010.0,no,legacy_lab_table,legacy_lab_table,2025-11-25
10.1371/journal.pone.0009573,how accurate and robust are the phylogenetic estimates of austronesian language relationships,PLoS ONE,2010.0,no,legacy_lab_table,legacy_lab_table,2025-11-25
10.1371/journal.pone.0012645,priming the semantic neighbourhood during the attentional blink,PLoS ONE,2010.0,no,legacy_lab_table,legacy_lab_table,2025-11-25
10.1371/journal.pone.0012255,sounds move a static visual object,PLoS ONE,2010.0,no,legacy_lab_table,legacy_lab_table,2025-11-25
10.1371/journal.pone.0011950,perceptual compensation is correlated with individuals autistic traits implications for models of sound change,PLoS ONE,2010.0,no,legacy_lab_table,legacy_lab_table,2025-11-25
10.1371/journal.pone.0008862,rapid species diagnosis for invasive candidiasis using mass spectrometry,PLoS ONE,2010.0,no,legacy_lab_table,legacy_lab_table,2025-11-25
10.1371/journal.pone.0008759,common premotor regions for the perception and production of prosody and correlations with empathy and prosodic ability,PLoS ONE,2010.0,no,legacy_lab_table,legacy_lab_table,2025-11-25
10.1371/journal.pone.0015283,the influence of natural barriers in shaping the genetic structure of maharashtra populations,PLoS ONE,2010.0,no,legacy_lab_table,legacy_lab_table,2025-11-25
10.1371/journal.pone.0014243,the structure of the eu mediasphere,PLoS ONE,2010.0,no,legacy_lab_table,legacy_lab_table,2025-11-25
10.1371/journal.pone.0013648,no childhood advantage in the acquisition of skill in using an artificial language rule,PLoS ONE,2010.0,no,legacy_lab_table,legacy_lab_table,2025-11-25
10.1371/journal.pone.0011679,culture shapes efficiency of facial age judgments,PLoS ONE,2010.0,no,legacy_lab_table,legacy_lab_table,2025-11-25
10.1371/journal.pone.0011571,the integration of prosodic speech in high functioning autism a preliminary fmri study,PLoS ONE,2010.0,no,legacy_lab_table,legacy_lab_table,2025-11-25
10.1371/journal.pone.0009895,genetic relationships of ethnic minorities in southwest china revealed by microsatellite markers,PLoS ONE,2010.0,no,legacy_lab_table,legacy_lab_table,2025-11-25
10.1371/journal.pone.0009889,words and melody are intertwined in perception of sung words eeg and behavioral evidence,PLoS ONE,2010.0,no,legacy_lab_table,legacy_lab_table,2025-11-25
10.1371/journal.pone.0008622,a neurosemantic theory of concrete noun representation based on the underlying brain codes,PLoS ONE,2010.0,no,legacy_lab_table,legacy_lab_table,2025-11-25
10.1371/journal.pone.0007126,how are barack obama and president elect differentially stored in the brain an erp investigation on the processing of proper and common noun pairs,PLoS ONE,2009.0,no,legacy_lab_table,legacy_lab_table,2025-11-25
10.1371/journal.pone.0008144,a biological rationale for musical scales,PLoS ONE,2009.0,no,legacy_lab_table,legacy_lab_table,2025-11-25
10.1371/journal.pone.0007933,motor and linguistic linking of space and time in the cerebellum,PLoS ONE,2009.0,no,legacy_lab_table,legacy_lab_table,2025-11-25
10.1371/journal.pone.0005372,modeling statistical properties of written text,PLoS ONE,2009.0,no,legacy_lab_table,legacy_lab_table,2025-11-25
10.1371/journal.pone.0004360,social distance evaluation in human parietal cortex,PLoS ONE,2009.0,no,legacy_lab_table,legacy_lab_table,2025-11-25
10.1111/j.1749-818x.2009.00157.x,the sociolinguistics of ethnicity in pittsburgh,Language and Linguistics Compass,2009.0,no,legacy_lab_table,legacy_lab_table,2025-11-25
10.1016/j.linged.2009.07.002,lessons about respect and affect in a korean heritage language school,Linguistics and Education,2009.0,no,legacy_lab_table,legacy_lab_table,2025-11-25
10.1016/j.pragma.2008.10.002,constructing leader identities through teasing at work,Journal of Pragmatics,2009.0,no,legacy_lab_table,legacy_lab_table,2025-11-25
10.4018/jdet.2008100105,a chinese interactive feedback system for a virtual campus,International Journal of Distance Education Technologies,2008.0,no,legacy_lab_table,legacy_lab_table,2025-11-25
10.1017/s1351324908004749,a structural approach to the automatic adjudication of word sense disagreements,Natural Language Engineering,2008.0,no,legacy_lab_table,legacy_lab_table,2025-11-25
10.1371/journal.pone.0002900,neuromagnetic evidence for early auditory restoration of fundamental pitch,PLoS ONE,2008.0,no,legacy_lab_table,legacy_lab_table,2025-11-25
10.1371/journal.pone.0003015,small scattered fragments do not a dwarf make biological and archaeological data indicate that prehistoric inhabitants of palau were normal sized,PLoS ONE,2008.0,no,legacy_lab_table,legacy_lab_table,2025-11-25
10.1111/j.1473-4192.2008.00197.x,response keep your piece nine years,International Journal of Applied Linguistics,2008.0,no,legacy_lab_table,legacy_lab_table,2025-11-25
10.1007/s10936-006-9022-y,analysis of a chinese phonetic compound database implications for orthographic processing,Journal of Psycholinguistic Research,2006.0,yes,legacy_lab_table,legacy_lab_table,2025-11-25
10.1017/s1366728905002154,transfer and changing linguistic norms in jersey norman french,Bilingualism: Language and Cognition,2005.0,no,legacy_lab_table,legacy_lab_table,2025-11-25
10.1016/j.cognition.2003.09.002,lexical orthographic knowledge develops from the beginning of literacy acquisition,Cognition,2004.0,no,legacy_lab_table,legacy_lab_table,2025-11-25
10.1177/05333160260620788,talking gender in the group,Group Analysis,2002.0,no,legacy_lab_table,legacy_lab_table,2025-11-25
10.1093/deafed/6.4.235,nouns and verbs in australian sign language an open and shut case,Journal of Deaf Studies and Deaf Education,2001.0,no,legacy_lab_table,legacy_lab_table,2025-11-25
10.1521/soco.1998.16.3.353,direction of comparison asymmetries in relational judgment the role of linguistic norms,Social Cognition,1998.0,no,legacy_lab_table,legacy_lab_table,2025-11-25
10.1121/1.420402,speechreading and the structure of the lexicon computationally modeling the effects of reduced phonetic distinctiveness on lexical uniqueness,Journal of the Acoustical Society of America,1997.0,no,legacy_lab_table,legacy_lab_table,2025-11-25
10.1177/002383099704000101,pronunciation by analogy impact of implementational choices on performance,Language and Speech,1997.0,no,legacy_lab_table,legacy_lab_table,2025-11-25
10.1017/cbo9780511620577.006,language and gender,,1988.0,no,legacy_lab_table,legacy_lab_table,2025-11-25
10.1037/020283,disadvantaged speech difference or deficit,Contemporary Psychology,1981.0,no,legacy_lab_table,legacy_lab_table,2025-11-25
10.1037/h0061404,the analysis of verbal behavior,Psychological Review,1944.0,no,legacy_lab_table,legacy_lab_table,2025-11-25
