doi,title,journal,year,decision,source,decision_source,last_updated
10.1371/journal.pone.0135980,ancient humans influenced the current spatial genetic structure of common walnut populations in asia,PLoS ONE,2015.0,no,legacy_lab_table,legacy_lab_table,2025-11-25
10.1371/journal.pone.0131791,demographic history of indigenous populations in mesoamerica based on mtdna sequence data,PLoS ONE,2015.0,no,legacy_lab_table,legacy_lab_table,2025-11-25
10.1371/journal.pone.0129463,speaker input variability does not explain why larger populations have simpler languages,PLoS ONE,2015.0,no,legacy_lab_table,legacy_lab_table,2025-11-25
10.1371/journal.pone.0128661,holocene demographic changes and the emergence of complex societies in prehistoric australia,PLoS ONE,2015.0,no,legacy_lab_table,legacy_lab_table,2025-11-25
10.1371/journal.pone.0126723,cerebral activations related to writing and drawing with each hand,PLoS ONE,2015.0,no,legacy_lab_table,legacy_lab_table,2025-11-25
10.1371/journal.pone.0124559,il10 variant g5311a is associated with visceral leishmaniasis in indian population,PLoS ONE,2015.0,no,legacy_lab_table,legacy_lab_table,2025-11-25
10.1371/journal.pone.0125725,using graph components derived from an associative concept dictionary to predict fmri neural activation patterns that represent the meaning of nouns,PLoS ONE,2015.0,no,legacy_lab_table,legacy_lab_table,2025-11-25
10.1371/journal.pone.0120747,determinants of performance of health systems concerning maternal and child health a global approach,PLoS ONE,2015.0,no,legacy_lab_table,legacy_lab_table,2025-11-25
10.1371/journal.pone.0119003,the production of nominal and verbal inflection in an agglutinative language evidence from hungarian,PLoS ONE,2015.0,no,legacy_lab_table,legacy_lab_table,2025-11-25
10.1371/journal.pone.0115557,perception of everyday sounds a developmental study of a free sorting task,PLoS ONE,2015.0,no,legacy_lab_table,legacy_lab_table,2025-11-25
10.1371/journal.pone.0120011,frequent video game players resist perceptual interference,PLoS ONE,2015.0,no,legacy_lab_table,legacy_lab_table,2025-11-25
10.1371/journal.pone.0132819,the neurophysiology of language processing shapes the evolution of grammar evidence from case marking,PLoS ONE,2015.0,no,legacy_lab_table,legacy_lab_table,2025-11-25
10.1371/journal.pone.0136645,evidence for multiple rhythmic skills,PLoS ONE,2015.0,no,legacy_lab_table,legacy_lab_table,2025-11-25
10.1371/journal.pone.0134251,levers for language growth characteristics and predictors of language trajectories between 4 and 7 years,PLoS ONE,2015.0,no,legacy_lab_table,legacy_lab_table,2025-11-25
10.1371/journal.pone.0124714,stochastic time models of syllable structure,PLoS ONE,2015.0,no,legacy_lab_table,legacy_lab_table,2025-11-25
10.1371/journal.pone.0114417,effects of metalinguistic awareness on reading comprehension and the mediator role of reading fluency from grades 2 to 4,PLoS ONE,2015.0,no,legacy_lab_table,legacy_lab_table,2025-11-25
10.1016/j.linged.2014.10.005,the construction of academic language in german classrooms communicative practices and linguistic norms in morning circles,Linguistics and Education,2015.0,no,legacy_lab_table,legacy_lab_table,2025-11-25
10.1016/j.jml.2014.01.003,when silent letters say more than a thousand words an implementation and evaluation of cdp in french,Journal of Memory and Language,2014.0,no,legacy_lab_table,legacy_lab_table,2025-11-25
10.1371/journal.pone.0094053,lexical variation and change in british sign language,PLoS ONE,2014.0,no,legacy_lab_table,legacy_lab_table,2025-11-25
10.1371/journal.pone.0088674,distinct patterns of brain activity characterise lexical activation and competition in spoken word production,PLoS ONE,2014.0,no,legacy_lab_table,legacy_lab_table,2025-11-25
10.1371/journal.pone.0104626,attentional blink is hierarchically modulated by phonological morphological semantic and lexical connections between two chinese characters,PLoS ONE,2014.0,no,legacy_lab_table,legacy_lab_table,2025-11-25
10.1371/journal.pone.0095587,developmental changes in mismatch responses to mandarin consonants and lexical tones from early to middle childhood,PLoS ONE,2014.0,no,legacy_lab_table,legacy_lab_table,2025-11-25
10.1371/journal.pone.0091988,immediate auditory repetition of words and nonwords an erp study of lexical and sublexical processing,PLoS ONE,2014.0,no,legacy_lab_table,legacy_lab_table,2025-11-25
10.1371/journal.pone.0085677,observer bias an interaction of temperament traits with biases in the semantic perception of lexical material,PLoS ONE,2014.0,no,legacy_lab_table,legacy_lab_table,2025-11-25
10.1371/journal.pone.0113114,diffusion of lexical change in social media,PLoS ONE,2014.0,no,legacy_lab_table,legacy_lab_table,2025-11-25
10.1371/journal.pone.0083126,implicit target substitution and sequencing for lexical tone production in chinese an fmri study,PLoS ONE,2014.0,no,legacy_lab_table,legacy_lab_table,2025-11-25
10.1371/journal.pone.0094291,cdpitalian modelling sublexical and supralexical inconsistency in a shallow orthography,PLoS ONE,2014.0,no,legacy_lab_table,legacy_lab_table,2025-11-25
10.1371/journal.pone.0112774,negations not solved generalizability versus optimizability in clinical natural language processing,PLoS ONE,2014.0,no,legacy_lab_table,legacy_lab_table,2025-11-25
10.1371/journal.pone.0092852,sound symbolism in the languages of australia,PLoS ONE,2014.0,no,legacy_lab_table,legacy_lab_table,2025-11-25
10.1371/journal.pone.0099710,differences between patterns of brain activity associated with semantics and those linked with phonological processing diminish with age,PLoS ONE,2014.0,no,legacy_lab_table,legacy_lab_table,2025-11-25
10.1371/journal.pone.0093136,testing the stem dominance hypothesis meaning analysis of inflected words and prepositional phrases,PLoS ONE,2014.0,no,legacy_lab_table,legacy_lab_table,2025-11-25
10.1371/journal.pone.0098598,divergence in dialogue,PLoS ONE,2014.0,no,legacy_lab_table,legacy_lab_table,2025-11-25
10.1371/journal.pone.0115846,the absoluteness of semantic processing lessons from the analysis of temporal clusters in phonemic verbal fluency,PLoS ONE,2014.0,no,legacy_lab_table,legacy_lab_table,2025-11-25
10.1371/journal.pone.0108937,gaze position reveals impaired attentional shift during visual word recognition in dysfluent readers,PLoS ONE,2014.0,no,legacy_lab_table,legacy_lab_table,2025-11-25
10.1371/journal.pone.0104701,retrieval intention modulates the effects of directed forgetting instructions on recollection,PLoS ONE,2014.0,no,legacy_lab_table,legacy_lab_table,2025-11-25
10.1371/journal.pone.0103139,fast and slow readers of the hebrew language show divergence in brain response 200 ms post stimulus an erp study,PLoS ONE,2014.0,no,legacy_lab_table,legacy_lab_table,2025-11-25
10.1371/journal.pone.0086212,rules from words a dynamic neural basis for a lawful linguistic process,PLoS ONE,2014.0,no,legacy_lab_table,legacy_lab_table,2025-11-25
10.1371/journal.pone.0086016,reading proficiency and adaptability in orthographic processing an examination of the effect of type of orthography read on brain activity in regular and dyslexic readers,PLoS ONE,2014.0,no,legacy_lab_table,legacy_lab_table,2025-11-25
10.1371/journal.pone.0112074,crowdsourcing dialect characterization through twitter,PLoS ONE,2014.0,no,legacy_lab_table,legacy_lab_table,2025-11-25
10.1371/journal.pone.0104645,argument structure and the representation of abstract semantics,PLoS ONE,2014.0,no,legacy_lab_table,legacy_lab_table,2025-11-25
10.1371/journal.pone.0092685,the pleasantness of visual symmetry always never or sometimes,PLoS ONE,2014.0,no,legacy_lab_table,legacy_lab_table,2025-11-25
10.1371/journal.pone.0090794,does n200 reflect semantic processingan erp study on chinese visual word recognition,PLoS ONE,2014.0,no,legacy_lab_table,legacy_lab_table,2025-11-25
10.1371/journal.pone.0089994,sign language ability in young deaf signers predicts comprehension of written sentences in english,PLoS ONE,2014.0,no,legacy_lab_table,legacy_lab_table,2025-11-25
10.1371/journal.pone.0112235,engagement with health agencies on twitter,PLoS ONE,2014.0,no,legacy_lab_table,legacy_lab_table,2025-11-25
10.1371/journal.pone.0098604,categorical biases in perceiving spatial relations,PLoS ONE,2014.0,no,legacy_lab_table,legacy_lab_table,2025-11-25
10.1371/journal.pone.0085683,chinese tone and vowel processing exhibits distinctive temporal characteristics an electrophysiological perspective from classical chinese poem processing,PLoS ONE,2014.0,no,legacy_lab_table,legacy_lab_table,2025-11-25
10.1371/journal.pone.0106231,linguistic analysis of the preschool five minute speech sample what the parents of preschool children with early signs of adhd say and how they say it,PLoS ONE,2014.0,no,legacy_lab_table,legacy_lab_table,2025-11-25
10.1371/journal.pone.0105937,linguistic traces of a scientific fraud the case of diederik stapel,PLoS ONE,2014.0,no,legacy_lab_table,legacy_lab_table,2025-11-25
10.1371/journal.pone.0095929,combinatorial communication in bacteria implications for the origins of linguistic generativity,PLoS ONE,2014.0,no,legacy_lab_table,legacy_lab_table,2025-11-25
10.1371/journal.pone.0095155,language universals engage brocas area,PLoS ONE,2014.0,no,legacy_lab_table,legacy_lab_table,2025-11-25
10.1371/journal.pone.0086268,discriminant features and temporal structure of nonmanuals in american sign language,PLoS ONE,2014.0,no,legacy_lab_table,legacy_lab_table,2025-11-25
10.1371/journal.pone.0091534,a linguistically informed autosomal str survey of human populations residing in the greater himalayan region,PLoS ONE,2014.0,no,legacy_lab_table,legacy_lab_table,2025-11-25
10.1371/journal.pone.0089184,comparing distributions of color words pitfalls and metric choices,PLoS ONE,2014.0,no,legacy_lab_table,legacy_lab_table,2025-11-25
10.1371/journal.pone.0099670,labels direct infants attention to commonalities during novel category learning,PLoS ONE,2014.0,no,legacy_lab_table,legacy_lab_table,2025-11-25
10.1371/journal.pone.0097344,the contribution of genetic diversity to subdivide populations living in the silk road of china,PLoS ONE,2014.0,no,legacy_lab_table,legacy_lab_table,2025-11-25
10.1371/journal.pone.0107131,strategy choice mediates the link between auditory processing and spelling,PLoS ONE,2014.0,no,legacy_lab_table,legacy_lab_table,2025-11-25
10.1371/journal.pone.0110213,when a text is translated does the complexity of its vocabulary change translations and target readerships,PLoS ONE,2014.0,no,legacy_lab_table,legacy_lab_table,2025-11-25
10.1371/journal.pone.0104880,emotions under discussion gender status and communication in online collaboration,PLoS ONE,2014.0,no,legacy_lab_table,legacy_lab_table,2025-11-25
10.1371/journal.pone.0095660,good fences the importance of setting boundaries for peaceful coexistence,PLoS ONE,2014.0,no,legacy_lab_table,legacy_lab_table,2025-11-25
10.1371/journal.pone.0106946,price comparisons on the internet based on computational intelligence,PLoS ONE,2014.0,no,legacy_lab_table,legacy_lab_table,2025-11-25
10.1371/journal.pone.0101340,faster sound stream segmentation in musicians than in nonmusicians,PLoS ONE,2014.0,no,legacy_lab_table,legacy_lab_table,2025-11-25
10.1371/journal.pone.0097905,how sound symbolism is processed in the brain a study on japanese mimetic words,PLoS ONE,2014.0,no,legacy_lab_table,legacy_lab_table,2025-11-25
10.1371/journal.pone.0097298,fmri evidence for the involvement of the procedural memory system in morphological processing of a second language,PLoS ONE,2014.0,no,legacy_lab_table,legacy_lab_table,2025-11-25
10.1371/journal.pone.0096240,developmental changes in the role of different metalinguistic awareness skills in chinese reading acquisition from preschool to third grade,PLoS ONE,2014.0,no,legacy_lab_table,legacy_lab_table,2025-11-25
10.1371/journal.pone.0110553,infants distinguish antisocial actions directed towards fair and unfair agents,PLoS ONE,2014.0,no,legacy_lab_table,legacy_lab_table,2025-11-25
10.1371/journal.pone.0114177,lewis carrolls doublets net of english words network heterogeneity in a complex system,PLoS ONE,2014.0,no,legacy_lab_table,legacy_lab_table,2025-11-25
10.1371/journal.pone.0112244,dynamics of cultural transmission in native americans of the high great plains,PLoS ONE,2014.0,no,legacy_lab_table,legacy_lab_table,2025-11-25
10.1371/journal.pone.0109002,genetics of the pig tapeworm in madagascar reveal a history of human dispersal and colonization,PLoS ONE,2014.0,no,legacy_lab_table,legacy_lab_table,2025-11-25
10.1371/journal.pone.0115381,how the context matters literal and figurative meaning in the embodied language paradigm,PLoS ONE,2014.0,no,legacy_lab_table,legacy_lab_table,2025-11-25
10.1371/journal.pone.0115162,responses to vocalizations and auditory controls in the human newborn brain,PLoS ONE,2014.0,no,legacy_lab_table,legacy_lab_table,2025-11-25
10.1371/journal.pone.0114172,inference or enaction the impact of genre on the narrative processing of other minds,PLoS ONE,2014.0,no,legacy_lab_table,legacy_lab_table,2025-11-25
10.1371/journal.pone.0111439,neural mechanisms underlying the computation of hierarchical tree structures in mathematics,PLoS ONE,2014.0,no,legacy_lab_table,legacy_lab_table,2025-11-25
10.1371/journal.pone.0106486,the role of phoneme in mandarin chinese production evidence from erps,PLoS ONE,2014.0,no,legacy_lab_table,legacy_lab_table,2025-11-25
10.1371/journal.pone.0103772,genetic structure of qiangic populations residing in the western sichuan corridor,PLoS ONE,2014.0,no,legacy_lab_table,legacy_lab_table,2025-11-25
10.1371/journal.pone.0096910,protein languages differ depending on microorganism lifestyle,PLoS ONE,2014.0,no,legacy_lab_table,legacy_lab_table,2025-11-25
10.1371/journal.pone.0096840,distinguishing neurocognitive processes reflected by p600 effects evidence from erps and neural oscillations,PLoS ONE,2014.0,no,legacy_lab_table,legacy_lab_table,2025-11-25
10.1371/journal.pone.0092835,contradictory reasoning network an eeg and fmri study,PLoS ONE,2014.0,no,legacy_lab_table,legacy_lab_table,2025-11-25
10.1371/journal.pone.0088665,neural substrates of interactive musical improvisation an fmri study of trading fours in jazz,PLoS ONE,2014.0,no,legacy_lab_table,legacy_lab_table,2025-11-25
10.1371/journal.pone.0087159,unilateral auditory cortex lesions impair or improve discrimination learning of amplitude modulated sounds depending on lesion side,PLoS ONE,2014.0,no,legacy_lab_table,legacy_lab_table,2025-11-25
10.1371/journal.pone.0087041,he votes or she votes female and male discursive strategies in twitter political hashtags,PLoS ONE,2014.0,no,legacy_lab_table,legacy_lab_table,2025-11-25
10.1371/journal.pone.0093978,word formation is aware of morpheme family size,PLoS ONE,2014.0,no,legacy_lab_table,legacy_lab_table,2025-11-25
10.1371/journal.pone.0107623,rapoports rule revisited geographical distributions of human languages,PLoS ONE,2014.0,no,legacy_lab_table,legacy_lab_table,2025-11-25
10.1371/journal.pone.0110009,children use statistics and semantics in the retreat from overgeneralization,PLoS ONE,2014.0,no,legacy_lab_table,legacy_lab_table,2025-11-25
10.1371/journal.pone.0102882,internal and external dynamics in language evidence from verb regularity in a historical corpus of english,PLoS ONE,2014.0,no,legacy_lab_table,legacy_lab_table,2025-11-25
10.1371/journal.pone.0092285,the development of diagnostic reasoning about uncertain events between ages 47,PLoS ONE,2014.0,no,legacy_lab_table,legacy_lab_table,2025-11-25
10.1371/journal.pone.0112544,from cognitive maps to cognitive graphs,PLoS ONE,2014.0,no,legacy_lab_table,legacy_lab_table,2025-11-25
10.1371/journal.pone.0111445,an information theoretic clustering approach for unveiling authorship affinities in shakespearean era plays and poems,PLoS ONE,2014.0,no,legacy_lab_table,legacy_lab_table,2025-11-25
10.1371/journal.pone.0101852,atrophic gastritis a related factor for osteoporosis in elderly women,PLoS ONE,2014.0,no,legacy_lab_table,legacy_lab_table,2025-11-25
10.1016/j.linged.2013.08.002,beyond language class social categorisation and academic achievement in a catalan high school,Linguistics and Education,2014.0,no,legacy_lab_table,legacy_lab_table,2025-11-25
10.1007/978-981-10-1909-8_1,indowordnet,,,yes,legacy_lab_table,legacy_lab_table,2025-11-25
10.21437/interspeech.2011-316,announcing the electromagnetic articulography day 1 subset of the mngu0 articulatory corpus,,2011.0,yes,legacy_lab_table,legacy_lab_table,2025-11-25
10.5334/pb.981,the international affective picture system a flemish validation study,,2001.0,yes,legacy_lab_table,legacy_lab_table,2025-11-25
10.5334/pb.864,affective and subjective familiarity ratings of 740 dutch words,Psychologica Belgica,1994.0,yes,legacy_lab_table,legacy_lab_table,2025-11-25
10.1371/journal.pone.0054696,lexical processing in deaf readers an fmri investigation of reading proficiency,PLoS ONE,2013.0,no,legacy_lab_table,legacy_lab_table,2025-11-25
10.1371/journal.pone.0056778,rapid extraction of lexical tone phonology in chinese characters a visual mismatch negativity study,PLoS ONE,2013.0,no,legacy_lab_table,legacy_lab_table,2025-11-25
10.1371/journal.pone.0053861,hand movement effects on word learning and retrieval in adults,PLoS ONE,2013.0,no,legacy_lab_table,legacy_lab_table,2025-11-25
10.1371/journal.pone.0083657,inferring emotions from speech prosody not so easy at age five,PLoS ONE,2013.0,no,legacy_lab_table,legacy_lab_table,2025-11-25
10.1371/journal.pone.0065366,structural similarities between brain and linguistic data provide evidence of semantic relations in the brain,PLoS ONE,2013.0,no,legacy_lab_table,legacy_lab_table,2025-11-25
10.1371/journal.pone.0064601,phrasal paraphrase based question reformulation for archived question retrieval,PLoS ONE,2013.0,no,legacy_lab_table,legacy_lab_table,2025-11-25
10.1371/journal.pone.0081461,interpreting quantifier scope ambiguity evidence of heuristic first algorithmic second processing,PLoS ONE,2013.0,no,legacy_lab_table,legacy_lab_table,2025-11-25
10.1371/journal.pone.0075776,adaptation to emotional conflict evidence from a novel face emotion paradigm,PLoS ONE,2013.0,no,legacy_lab_table,legacy_lab_table,2025-11-25
10.1371/journal.pone.0079247,intact lexicon running slowly prolonged response latencies in patients with subthalamic dbs and verbal fluency deficits,PLoS ONE,2013.0,no,legacy_lab_table,legacy_lab_table,2025-11-25
10.1371/journal.pone.0075000,semantic size of abstract concepts it gets emotional when you cant see it,PLoS ONE,2013.0,no,legacy_lab_table,legacy_lab_table,2025-11-25
10.1371/journal.pone.0074591,humans process dog and human facial affect in similar ways,PLoS ONE,2013.0,no,legacy_lab_table,legacy_lab_table,2025-11-25
10.1371/journal.pone.0059080,visual word recognition in deaf readers lexicality is modulated by communication mode,PLoS ONE,2013.0,no,legacy_lab_table,legacy_lab_table,2025-11-25
10.1371/journal.pone.0073359,young toddlers word comprehension is flexible and efficient,PLoS ONE,2013.0,no,legacy_lab_table,legacy_lab_table,2025-11-25
10.1371/journal.pone.0078273,is huh a universal word conversational infrastructure and the convergent evolution of linguistic items,PLoS ONE,2013.0,no,legacy_lab_table,legacy_lab_table,2025-11-25
10.1371/journal.pone.0074304,metaphor interpretation using paraphrases extracted from the web,PLoS ONE,2013.0,no,legacy_lab_table,legacy_lab_table,2025-11-25
10.1371/journal.pone.0063238,phonotactic diversity predicts the time depth of the worlds language families,PLoS ONE,2013.0,no,legacy_lab_table,legacy_lab_table,2025-11-25
10.1371/journal.pone.0056230,syntactic computation in the human brain the degree of merger as a key factor,PLoS ONE,2013.0,no,legacy_lab_table,legacy_lab_table,2025-11-25
10.1371/journal.pone.0079279,speech recognition in natural background noise,PLoS ONE,2013.0,no,legacy_lab_table,legacy_lab_table,2025-11-25
10.1371/journal.pone.0077661,rapid expectation adaptation during syntactic comprehension,PLoS ONE,2013.0,no,legacy_lab_table,legacy_lab_table,2025-11-25
10.1371/journal.pone.0073949,flexible composition meg evidence for the deployment of basic combinatorial linguistic mechanisms in response to task demands,PLoS ONE,2013.0,no,legacy_lab_table,legacy_lab_table,2025-11-25
10.1371/journal.pone.0071914,connected text reading and differences in text reading fluency in adult readers,PLoS ONE,2013.0,no,legacy_lab_table,legacy_lab_table,2025-11-25
10.1371/journal.pone.0070788,early prefrontal brain responses to the hedonic quality of emotional words a simultaneous eeg and meg study,PLoS ONE,2013.0,no,legacy_lab_table,legacy_lab_table,2025-11-25
10.1371/journal.pone.0067777,missing links in middle school developing use of disciplinary relatedness in evaluating internet search results,PLoS ONE,2013.0,no,legacy_lab_table,legacy_lab_table,2025-11-25
10.1371/journal.pone.0063196,hemispheric specialization varies with eeg brain resting states and phase of menstrual cycle,PLoS ONE,2013.0,no,legacy_lab_table,legacy_lab_table,2025-11-25
10.1371/journal.pone.0056872,reading sun and looking up the influence of language on saccadic eye movements in the vertical dimension,PLoS ONE,2013.0,no,legacy_lab_table,legacy_lab_table,2025-11-25
10.1371/journal.pone.0060676,tone language speakers and musicians share enhanced perceptual and cognitive abilities for musical pitch evidence for bidirectionality between the domains of language and music,PLoS ONE,2013.0,no,legacy_lab_table,legacy_lab_table,2025-11-25
10.3109/02699206.2013.766764,early phonological development creating an assessment test,Clinical Linguistics & Phonetics,2013.0,no,legacy_lab_table,legacy_lab_table,2025-11-25
10.1371/journal.pone.0065275,evidence for direct geographic influences on linguistic sounds the case of ejectives,PLoS ONE,2013.0,no,legacy_lab_table,legacy_lab_table,2025-11-25
10.1371/journal.pone.0064099,a bayesian approach to genomelinguistic relationships in native south americans,PLoS ONE,2013.0,no,legacy_lab_table,legacy_lab_table,2025-11-25
10.1371/journal.pone.0081704,demographic histories isolation and social factors as determinants of the genetic structure of alpine linguistic groups,PLoS ONE,2013.0,no,legacy_lab_table,legacy_lab_table,2025-11-25
10.1371/journal.pone.0070902,linguistic diversity and traffic accidents lessons from statistical studies of cultural traits,PLoS ONE,2013.0,no,legacy_lab_table,legacy_lab_table,2025-11-25
10.1371/journal.pone.0067905,dynamic neural processing of linguistic cues related to death,PLoS ONE,2013.0,no,legacy_lab_table,legacy_lab_table,2025-11-25
10.1371/journal.pone.0074683,childrens computation of complex linguistic forms a study of frequency and imageability effects,PLoS ONE,2013.0,no,legacy_lab_table,legacy_lab_table,2025-11-25
10.1371/journal.pone.0060617,amodal aspects of linguistic design,PLoS ONE,2013.0,no,legacy_lab_table,legacy_lab_table,2025-11-25
10.1371/journal.pone.0083780,statistics of language morphology change from biconsonantal hunters to triconsonantal farmers,PLoS ONE,2013.0,no,legacy_lab_table,legacy_lab_table,2025-11-25
10.1371/journal.pone.0056371,detecting genetic isolation in human populations a study of european language minorities,PLoS ONE,2013.0,no,legacy_lab_table,legacy_lab_table,2025-11-25
10.1371/journal.pone.0069945,connectivity not frequency determines the fate of a morpheme,PLoS ONE,2013.0,no,legacy_lab_table,legacy_lab_table,2025-11-25
10.1371/journal.pone.0061981,the twitter of babel mapping world languages through microblogging platforms,PLoS ONE,2013.0,no,legacy_lab_table,legacy_lab_table,2025-11-25
10.1371/journal.pone.0053398,the tracking of speech envelope in the human cortex,PLoS ONE,2013.0,no,legacy_lab_table,legacy_lab_table,2025-11-25
10.1371/journal.pone.0081688,appraisal of space words and allocation of emotion words in bodily space,PLoS ONE,2013.0,no,legacy_lab_table,legacy_lab_table,2025-11-25
10.1371/journal.pone.0079701,speaker sex influences processing of grammatical gender,PLoS ONE,2013.0,no,legacy_lab_table,legacy_lab_table,2025-11-25
10.1371/journal.pone.0072677,syntax at hand common syntactic structures for actions and language,PLoS ONE,2013.0,no,legacy_lab_table,legacy_lab_table,2025-11-25
10.1371/journal.pone.0069172,the critical period hypothesis in second language acquisition a statistical critique and a reanalysis,PLoS ONE,2013.0,no,legacy_lab_table,legacy_lab_table,2025-11-25
10.1371/journal.pone.0066839,whats behind a p600 integration operations during irony processing,PLoS ONE,2013.0,no,legacy_lab_table,legacy_lab_table,2025-11-25
10.1371/journal.pone.0055009,some structural aspects of language are more stable than others a comparison of seven methods,PLoS ONE,2013.0,no,legacy_lab_table,legacy_lab_table,2025-11-25
10.1371/journal.pone.0080546,enhanced syllable discrimination thresholds in musicians,PLoS ONE,2013.0,no,legacy_lab_table,legacy_lab_table,2025-11-25
10.1371/journal.pone.0079522,insight into the peopling of mainland southeast asia from thai population genetic structure,PLoS ONE,2013.0,no,legacy_lab_table,legacy_lab_table,2025-11-25
10.1371/journal.pone.0078600,development of a serial order in speech constrained by articulatory coordination,PLoS ONE,2013.0,no,legacy_lab_table,legacy_lab_table,2025-11-25
10.1371/journal.pone.0069696,meg correlates of learning novel objects properties in children,PLoS ONE,2013.0,no,legacy_lab_table,legacy_lab_table,2025-11-25
10.1371/journal.pone.0062343,metaphor identification in large texts corpora,PLoS ONE,2013.0,no,legacy_lab_table,legacy_lab_table,2025-11-25
10.1371/journal.pone.0053227,the evolution of the exponent of zipfs law in language ontogeny,PLoS ONE,2013.0,no,legacy_lab_table,legacy_lab_table,2025-11-25
10.1371/journal.pone.0085151,the impact of social context and language comprehension on behaviour a kinematic investigation,PLoS ONE,2013.0,no,legacy_lab_table,legacy_lab_table,2025-11-25
