doi,title,journal,year,decision,source,decision_source,last_updated
10.1371/journal.pone.0221891,reading skill modulates the effect of parafoveal distractors on foveal lexical decision in deaf students,PLoS ONE,2019.0,no,legacy_lab_table,legacy_lab_table,2025-11-25
10.1371/journal.pone.0223588,the causality of borrowing lexical loans in eurasian languages,PLoS ONE,2019.0,no,legacy_lab_table,legacy_lab_table,2025-11-25
10.1371/journal.pone.0220891,lexical landscapes as large in silico data for examining advanced properties of fitness landscapes,PLoS ONE,2019.0,no,legacy_lab_table,legacy_lab_table,2025-11-25
10.1371/journal.pone.0210793,abstract social categories facilitate access to socially skewed words,PLoS ONE,2019.0,no,legacy_lab_table,legacy_lab_table,2025-11-25
10.1371/journal.pone.0209524,italian norms and naming latencies for 357 high quality color images,PLoS ONE,2019.0,yes,legacy_lab_table,legacy_lab_table,2025-11-25
10.1371/journal.pone.0212624,electrophysiological correlates of concept type shifts,PLoS ONE,2019.0,no,legacy_lab_table,legacy_lab_table,2025-11-25
10.1371/journal.pone.0218802,ndra a single route model of response times in the reading aloud task based on discriminative learning,PLoS ONE,2019.0,no,legacy_lab_table,legacy_lab_table,2025-11-25
10.1371/journal.pone.0211336,mandarin chinese modality exclusivity norms,PLoS ONE,2019.0,yes,legacy_lab_table,legacy_lab_table,2025-11-25
10.1371/journal.pone.0211809,network motifs for translator stylometry identification,PLoS ONE,2019.0,no,legacy_lab_table,legacy_lab_table,2025-11-25
10.1371/journal.pone.0208318,embedded word priming elicits enhanced fmri responses in the visual word form area,PLoS ONE,2019.0,no,legacy_lab_table,legacy_lab_table,2025-11-25
10.1371/journal.pone.0210457,a preliminary study of auditory mismatch response on the day of cochlear implant activation in children with hearing aids prior implantation,PLoS ONE,2019.0,no,legacy_lab_table,legacy_lab_table,2025-11-25
10.1371/journal.pone.0223994,visualizing a field of research a methodology of systematic scientometric reviews,PLoS ONE,2019.0,no,legacy_lab_table,legacy_lab_table,2025-11-25
10.1371/journal.pone.0209961,beyond opinion classification extracting facts opinions and experiences from health forums,PLoS ONE,2019.0,no,legacy_lab_table,legacy_lab_table,2025-11-25
10.1371/journal.pone.0216124,impaired processing speed in categorical perception speech perception of children who stutter,PLoS ONE,2019.0,no,legacy_lab_table,legacy_lab_table,2025-11-25
10.1371/journal.pone.0210450,pupillary responses to affective words in bilinguals first versus second language,PLoS ONE,2019.0,no,legacy_lab_table,legacy_lab_table,2025-11-25
10.1371/journal.pone.0224152,keepin it real linguistic models of authenticity judgments for artificially generated rap lyrics,PLoS ONE,2019.0,no,legacy_lab_table,legacy_lab_table,2025-11-25
10.1371/journal.pone.0217051,extrafoveal attentional capture by object semantics,PLoS ONE,2019.0,no,legacy_lab_table,legacy_lab_table,2025-11-25
10.1371/journal.pone.0222062,stylistic variation on the donald trump twitter account a linguistic analysis of tweets posted between 2009 and 2018,PLoS ONE,2019.0,no,legacy_lab_table,legacy_lab_table,2025-11-25
10.1371/journal.pone.0217363,the geographical configuration of a language area influences linguistic diversity,PLoS ONE,2019.0,no,legacy_lab_table,legacy_lab_table,2025-11-25
10.1371/journal.pone.0212342,talk2me automated linguistic data collection for personal assessment,PLoS ONE,2019.0,yes,legacy_lab_table,legacy_lab_table,2025-11-25
10.1371/journal.pone.0224090,linguistic neutrosophic power muirhead mean operators for safety evaluation of mines,PLoS ONE,2019.0,no,legacy_lab_table,legacy_lab_table,2025-11-25
10.1371/journal.pone.0207741,hierarchical structure guides rapid linguistic predictions during naturalistic listening,PLoS ONE,2019.0,no,legacy_lab_table,legacy_lab_table,2025-11-25
10.1371/journal.pone.0220611,age of acquisition of 299 words in seven languages american english czech gaelic lebanese arabic malay persian and western armenian,PLoS ONE,2019.0,yes,legacy_lab_table,legacy_lab_table,2025-11-25
10.1371/journal.pone.0220928,impact of depression on speech perception in noise,PLoS ONE,2019.0,no,legacy_lab_table,legacy_lab_table,2025-11-25
10.1371/journal.pone.0221933,writers uncertainty in scientific and popular biomedical articles a comparative analysis of the british medical journal and discover magazine,PLoS ONE,2019.0,no,legacy_lab_table,legacy_lab_table,2025-11-25
10.1371/journal.pone.0221689,reference values for psychoacoustic tests on polish school children 710 years old,PLoS ONE,2019.0,no,legacy_lab_table,legacy_lab_table,2025-11-25
10.1371/journal.pone.0220041,statistical learning abilities of children with dyslexia across three experimental paradigms,PLoS ONE,2019.0,no,legacy_lab_table,legacy_lab_table,2025-11-25
10.1371/journal.pone.0217966,phonetic acquisition in cortical dynamics a computational approach,PLoS ONE,2019.0,no,legacy_lab_table,legacy_lab_table,2025-11-25
10.1371/journal.pone.0212306,and sympathy is what we need my friendpolite requests improve negotiation results,PLoS ONE,2019.0,no,legacy_lab_table,legacy_lab_table,2025-11-25
10.1371/journal.pone.0212844,tecla a temperament and psychological type prediction framework from twitter data,PLoS ONE,2019.0,no,legacy_lab_table,legacy_lab_table,2025-11-25
10.1371/journal.pone.0211872,resolution of grammatical tense into actual time and its application in time perspective study in the tweet space,PLoS ONE,2019.0,no,legacy_lab_table,legacy_lab_table,2025-11-25
10.1371/journal.pone.0208450,liberals lecture conservatives communicate analyzing complexity and ideology in 381609 political speeches,PLoS ONE,2019.0,no,legacy_lab_table,legacy_lab_table,2025-11-25
10.1371/journal.pone.0210113,a geospatial approach to understanding inequalities in accessibility to primary care among vulnerable populations,PLoS ONE,2019.0,no,legacy_lab_table,legacy_lab_table,2025-11-25
10.1371/journal.pone.0220623,can acute suicidality be predicted by instagram data results from qualitative and quantitative language analyses,PLoS ONE,2019.0,no,legacy_lab_table,legacy_lab_table,2025-11-25
10.1371/journal.pone.0209461,seeing emotions reading emotions behavioral and erps evidence of the regulation of pictures and words,PLoS ONE,2019.0,no,legacy_lab_table,legacy_lab_table,2025-11-25
10.1371/journal.pone.0217404,disturbing the rhythm of thought speech pausing patterns in schizophrenia with and without formal thought disorder,PLoS ONE,2019.0,no,legacy_lab_table,legacy_lab_table,2025-11-25
10.1371/journal.pone.0217388,a new diagnostic approach for the identification of patients with neurodegenerative cognitive complaints,PLoS ONE,2019.0,no,legacy_lab_table,legacy_lab_table,2025-11-25
10.1371/journal.pone.0215573,assessing the importance of cultural diffusion in the bantu spread into southeastern africa,PLoS ONE,2019.0,no,legacy_lab_table,legacy_lab_table,2025-11-25
10.1371/journal.pone.0215202,psychometric assessments of persian translations of three measures of conspiracist beliefs,PLoS ONE,2019.0,no,legacy_lab_table,legacy_lab_table,2025-11-25
10.1371/journal.pone.0214799,effect of modulating braille dot height on reading regressions,PLoS ONE,2019.0,no,legacy_lab_table,legacy_lab_table,2025-11-25
10.1371/journal.pone.0213343,development and validation of the japanese moral foundations dictionary,PLoS ONE,2019.0,yes,legacy_lab_table,legacy_lab_table,2025-11-25
10.1371/journal.pone.0209125,mitogenomes illuminate the origin and migration patterns of the indigenous people of the canary islands,PLoS ONE,2019.0,no,legacy_lab_table,legacy_lab_table,2025-11-25
10.1371/journal.pone.0213492,standardizing test scores for a target population the lms method illustrated using language measures from the scales project,PLoS ONE,2019.0,no,legacy_lab_table,legacy_lab_table,2025-11-25
10.1371/journal.pone.0223502,associations between focus constructions and levels of exhaustivity an experimental investigation of chinese,PLoS ONE,2019.0,no,legacy_lab_table,legacy_lab_table,2025-11-25
10.1371/journal.pone.0211512,the natural selection of words finding the features of fitness,PLoS ONE,2019.0,yes,legacy_lab_table,legacy_lab_table,2025-11-25
10.1371/journal.pone.0219570,enhanced convolutional neural network for plankton identification and enumeration,PLoS ONE,2019.0,no,legacy_lab_table,legacy_lab_table,2025-11-25
10.1371/journal.pone.0210698,on the prevalence of racial discrimination in the united states,PLoS ONE,2019.0,no,legacy_lab_table,legacy_lab_table,2025-11-25
10.1371/journal.pone.0223621,clinical use of sand battery to evaluate language in patients with progressive supranuclear palsy,PLoS ONE,2019.0,no,legacy_lab_table,legacy_lab_table,2025-11-25
10.1371/journal.pone.0213544,asymmetric morality blame is more differentiated and more extreme than praise,PLoS ONE,2019.0,no,legacy_lab_table,legacy_lab_table,2025-11-25
10.1371/journal.pone.0211428,deliberate reasoning is not affected by language,PLoS ONE,2019.0,no,legacy_lab_table,legacy_lab_table,2025-11-25
10.1371/journal.pone.0210668,using bootstrapped quantile regression analysis for small sample research in applied linguistics some methodological considerations,PLoS ONE,2019.0,no,legacy_lab_table,legacy_lab_table,2025-11-25
10.3389/fpsyg.2018.02156,spalex a spanish lexical decision database from a massive online data collection,Frontiers in Psychology,2018.0,yes,legacy_lab_table,legacy_lab_table,2025-11-25
10.1371/journal.pone.0205250,lexirumah an online lexical database of the lesser sunda islands,PLoS ONE,2018.0,yes,legacy_lab_table,legacy_lab_table,2025-11-25
10.1371/journal.pone.0194762,seeing for speaking semantic and lexical information provided by briefly presented naturalistic action scenes,PLoS ONE,2018.0,no,legacy_lab_table,legacy_lab_table,2025-11-25
10.1371/journal.pone.0207578,ruminative minds wandering minds effects of rumination and mind wandering on lexical associations pitch imitation and eye behaviour,PLoS ONE,2018.0,no,legacy_lab_table,legacy_lab_table,2025-11-25
10.1371/journal.pone.0197304,lexical representation explains cortical entrainment during speech comprehension,PLoS ONE,2018.0,no,legacy_lab_table,legacy_lab_table,2025-11-25
10.1371/journal.pone.0189080,the rumour spectrum,PLoS ONE,2018.0,no,legacy_lab_table,legacy_lab_table,2025-11-25
10.1371/journal.pone.0204270,are tones in the expressive lexicon iconic evidence from three chinese languages,PLoS ONE,2018.0,no,legacy_lab_table,legacy_lab_table,2025-11-25
10.1371/journal.pone.0193200,automatic social comparison cognitive load facilitates an increase in negative thought accessibility after thin ideal exposure among women,PLoS ONE,2018.0,no,legacy_lab_table,legacy_lab_table,2025-11-25
10.1371/journal.pone.0201545,deficits in nominal reference identify thought disordered speech in a narrative production task,PLoS ONE,2018.0,no,legacy_lab_table,legacy_lab_table,2025-11-25
10.1371/journal.pone.0198646,thought probes during prospective memory encoding evidence for perfunctory processes,PLoS ONE,2018.0,no,legacy_lab_table,legacy_lab_table,2025-11-25
10.1371/journal.pone.0198001,eye movements and postural control in dyslexic children performing different visual tasks,PLoS ONE,2018.0,no,legacy_lab_table,legacy_lab_table,2025-11-25
10.1371/journal.pone.0194959,structural priming in sentence comprehension a single prime is enough,PLoS ONE,2018.0,no,legacy_lab_table,legacy_lab_table,2025-11-25
10.1371/journal.pone.0190818,the language disorder of prion disease is characteristic of a dynamic aphasia and is rarely an isolated clinical feature,PLoS ONE,2018.0,no,legacy_lab_table,legacy_lab_table,2025-11-25
10.1371/journal.pone.0197313,the interplay between selective and nonselective inhibition during single word production,PLoS ONE,2018.0,no,legacy_lab_table,legacy_lab_table,2025-11-25
10.1371/journal.pone.0192719,a test of the symbol interdependency hypothesis with both concrete and abstract stimuli,PLoS ONE,2018.0,no,legacy_lab_table,legacy_lab_table,2025-11-25
10.1371/journal.pone.0208785,improve word embedding using both writing and pronunciation,PLoS ONE,2018.0,no,legacy_lab_table,legacy_lab_table,2025-11-25
10.1371/journal.pone.0207643,semantic algorithms can detect how media language shapes survey responses in organizational behaviour,PLoS ONE,2018.0,no,legacy_lab_table,legacy_lab_table,2025-11-25
10.1371/journal.pone.0200262,functional atlases for analysis of motor and neuropsychological outcomes after medial globus pallidus and subthalamic stimulation,PLoS ONE,2018.0,no,legacy_lab_table,legacy_lab_table,2025-11-25
10.1371/journal.pone.0193094,jointly learning word embeddings using a corpus and a knowledge base,PLoS ONE,2018.0,no,legacy_lab_table,legacy_lab_table,2025-11-25
10.1371/journal.pone.0191656,the modulating effect of education on semantic interference during healthy aging,PLoS ONE,2018.0,no,legacy_lab_table,legacy_lab_table,2025-11-25
10.1371/journal.pone.0197678,deviance sensitivity in the auditory cortex of freely moving rats,PLoS ONE,2018.0,no,legacy_lab_table,legacy_lab_table,2025-11-25
10.1371/journal.pone.0190793,behavioral and subcortical signatures of musical expertise in mandarin chinese speakers,PLoS ONE,2018.0,no,legacy_lab_table,legacy_lab_table,2025-11-25
10.1073/pnas.1721059115,the dynamics of norm change in the cultural evolution of language,PNAS Proceedings of the National Academy of Sciences of the United States of America,2018.0,no,legacy_lab_table,legacy_lab_table,2025-11-25
10.1371/journal.pone.0205313,diachronic atlas of comparative linguistics diacla database for ancient language typology,PLoS ONE,2018.0,yes,legacy_lab_table,legacy_lab_table,2025-11-25
10.1371/journal.pone.0208855,deriving the priority weights from probabilistic linguistic preference relation with unknown probabilities,PLoS ONE,2018.0,no,legacy_lab_table,legacy_lab_table,2025-11-25
10.1371/journal.pone.0206178,linguistic neutrosophic hamacher aggregation operators and the application in evaluating land reclamation schemes for mines,PLoS ONE,2018.0,no,legacy_lab_table,legacy_lab_table,2025-11-25
10.1371/journal.pone.0206591,the role of age theory of mind and linguistic ability in childrens understanding of ownership,PLoS ONE,2018.0,no,legacy_lab_table,legacy_lab_table,2025-11-25
10.1371/journal.pone.0199743,quantifier comprehension is linked to linguistic rather than to numerical skills evidence from children with down syndrome and williams syndrome,PLoS ONE,2018.0,no,legacy_lab_table,legacy_lab_table,2025-11-25
10.1371/journal.pone.0207814,linguistic analysis of the autobiographical memories of individuals with major depressive disorder,PLoS ONE,2018.0,no,legacy_lab_table,legacy_lab_table,2025-11-25
10.1371/journal.pone.0195496,optimal linguistic expression in negotiations depends on visual appearance,PLoS ONE,2018.0,no,legacy_lab_table,legacy_lab_table,2025-11-25
10.1371/journal.pone.0206616,cue integration during sentence comprehension electrophysiological evidence from ellipsis,PLoS ONE,2018.0,no,legacy_lab_table,legacy_lab_table,2025-11-25
10.1371/journal.pone.0208695,word sense disambiguation using hybrid swarm intelligence approach,PLoS ONE,2018.0,no,legacy_lab_table,legacy_lab_table,2025-11-25
10.1371/journal.pone.0193219,growth developmental achievements and vaccines timeliness of undocumented migrant children from eritrea compared with israelis,PLoS ONE,2018.0,no,legacy_lab_table,legacy_lab_table,2025-11-25
10.1371/journal.pone.0195547,motor but not auditory attention affects syntactic choice,PLoS ONE,2018.0,no,legacy_lab_table,legacy_lab_table,2025-11-25
10.1371/journal.pone.0206188,national character stereotypes mirror language use a study of canadian and american tweets,PLoS ONE,2018.0,no,legacy_lab_table,legacy_lab_table,2025-11-25
10.1371/journal.pone.0206788,childrens syntactic representation of the transitive constructions in mandarin chinese,PLoS ONE,2018.0,no,legacy_lab_table,legacy_lab_table,2025-11-25
10.1371/journal.pone.0200753,an empirical study of collaborative capacity evaluation and scheduling optimization for a cpd project,PLoS ONE,2018.0,no,legacy_lab_table,legacy_lab_table,2025-11-25
10.1371/journal.pone.0206308,quantity processing of chinese numeral classifiers distance and congruity effects,PLoS ONE,2018.0,no,legacy_lab_table,legacy_lab_table,2025-11-25
10.1371/journal.pone.0201476,anticoagulation knowledge tool akt further evidence of validity in the italian population,PLoS ONE,2018.0,no,legacy_lab_table,legacy_lab_table,2025-11-25
10.1371/journal.pone.0209915,parallel but independent reduction of emotional awareness and corpus callosum connectivity in older age,PLoS ONE,2018.0,no,legacy_lab_table,legacy_lab_table,2025-11-25
10.1371/journal.pone.0208227,the geographic evolution of political cleavages in switzerland a network approach to assessing levels and dynamics of polarization between local populations,PLoS ONE,2018.0,no,legacy_lab_table,legacy_lab_table,2025-11-25
10.1371/journal.pone.0206057,sense classification of shallow discourse relations with focused rnns,PLoS ONE,2018.0,no,legacy_lab_table,legacy_lab_table,2025-11-25
10.1371/journal.pone.0204368,new evidence of megafaunal bone damage indicates late colonization of madagascar,PLoS ONE,2018.0,no,legacy_lab_table,legacy_lab_table,2025-11-25
10.1371/journal.pone.0202600,the interpreters brain during rest hyperconnectivity in the frontal lobe,PLoS ONE,2018.0,no,legacy_lab_table,legacy_lab_table,2025-11-25
10.1371/journal.pone.0201444,articulatory acoustic and prosodic accommodation in a cooperative maze navigation task,PLoS ONE,2018.0,no,legacy_lab_table,legacy_lab_table,2025-11-25
10.1371/journal.pone.0198468,eliciting improved quantitative judgements using the idea protocol a case study in natural resource management,PLoS ONE,2018.0,no,legacy_lab_table,legacy_lab_table,2025-11-25
10.1371/journal.pone.0197002,diurnal variations of psychometric indicators in twitter content,PLoS ONE,2018.0,no,legacy_lab_table,legacy_lab_table,2025-11-25
10.1371/journal.pone.0199045,development of fricative sound perception in korean infants the role of language experience and infants initial sensitivity,PLoS ONE,2018.0,no,legacy_lab_table,legacy_lab_table,2025-11-25
10.1371/journal.pone.0198333,literary evidence for taro in the ancient mediterranean a chronology of names and uses in a multilingual world,PLoS ONE,2018.0,no,legacy_lab_table,legacy_lab_table,2025-11-25
10.1371/journal.pone.0194771,can sign language make you better at hand processing,PLoS ONE,2018.0,no,legacy_lab_table,legacy_lab_table,2025-11-25
10.1371/journal.pone.0193450,the skills related to the early reading acquisition in spain and peru,PLoS ONE,2018.0,no,legacy_lab_table,legacy_lab_table,2025-11-25
10.1371/journal.pone.0193166,early cessation of ceramic production for ancestral polynesian society in tonga,PLoS ONE,2018.0,no,legacy_lab_table,legacy_lab_table,2025-11-25
10.1371/journal.pone.0192320,manual action verbs modulate the grip force of each hand in unimanual or symmetrical bimanual tasks,PLoS ONE,2018.0,no,legacy_lab_table,legacy_lab_table,2025-11-25
10.1371/journal.pone.0192061,how do you perceive this author understanding and modeling authors communication quality in social media,PLoS ONE,2018.0,no,legacy_lab_table,legacy_lab_table,2025-11-25
10.1371/journal.pone.0209651,english verb regularization in books and tweets,PLoS ONE,2018.0,no,legacy_lab_table,legacy_lab_table,2025-11-25
10.1371/journal.pone.0209547,qualitative analysis of manual annotations of clinical text with snomed ct,PLoS ONE,2018.0,yes,legacy_lab_table,legacy_lab_table,2025-11-25
10.1371/journal.pone.0208418,idea density in japanese for the early detection of dementia based on narrative speech,PLoS ONE,2018.0,no,legacy_lab_table,legacy_lab_table,2025-11-25
10.1371/journal.pone.0207592,the effect of emotion on morphosyntactic learning in foreign language learners,PLoS ONE,2018.0,no,legacy_lab_table,legacy_lab_table,2025-11-25
10.1371/journal.pone.0196593,predicting language diversity with complex networks,PLoS ONE,2018.0,no,legacy_lab_table,legacy_lab_table,2025-11-25
10.1371/journal.pone.0199358,maintaining information about speech input during accent adaptation,PLoS ONE,2018.0,no,legacy_lab_table,legacy_lab_table,2025-11-25
10.1371/journal.pone.0204223,pointing to the right side an erp study on anaphora resolution in german sign language,PLoS ONE,2018.0,no,legacy_lab_table,legacy_lab_table,2025-11-25
10.1371/journal.pone.0199787,subjective speech quality measurement with and without parallel task laboratory test results comparison,PLoS ONE,2018.0,no,legacy_lab_table,legacy_lab_table,2025-11-25
10.1371/journal.pone.0192773,a quick aphasia battery for efficient reliable and multidimensional assessment of language function,PLoS ONE,2018.0,no,legacy_lab_table,legacy_lab_table,2025-11-25
10.1007/s12559-017-9502-4,a novel technique for detecting plagiarism in documents exploiting information sources,Cognitive Computation,2017.0,no,legacy_lab_table,legacy_lab_table,2025-11-25
10.1093/deafed/enx014,operationalization of sign language phonological similarity and its effects on lexical access,Journal of Deaf Studies and Deaf Education,2017.0,no,legacy_lab_table,legacy_lab_table,2025-11-25
10.1371/journal.pone.0171935,discrimination in lexical decision,PLoS ONE,2017.0,no,legacy_lab_table,legacy_lab_table,2025-11-25
10.1371/journal.pone.0177794,using stochastic language models slm to map lexical syntactic and phonological information processing in the brain,PLoS ONE,2017.0,no,legacy_lab_table,legacy_lab_table,2025-11-25
10.1371/journal.pone.0180885,an iterative approach for the global estimation of sentence similarity,PLoS ONE,2017.0,no,legacy_lab_table,legacy_lab_table,2025-11-25
10.1371/journal.pone.0182337,phonetic complexity affects childrens mandarin tone production accuracy in disyllabic words a perceptual study,PLoS ONE,2017.0,no,legacy_lab_table,legacy_lab_table,2025-11-25
10.1371/journal.pone.0188728,auditory word recognition of verbs effects of verb argument structure on referent identification,PLoS ONE,2017.0,no,legacy_lab_table,legacy_lab_table,2025-11-25
10.1371/journal.pone.0188526,neural correlates of processing sentences and compound words in chinese,PLoS ONE,2017.0,no,legacy_lab_table,legacy_lab_table,2025-11-25
10.1371/journal.pone.0175578,to electrify bilingualism electrophysiological insights into bilingual metaphor comprehension,PLoS ONE,2017.0,no,legacy_lab_table,legacy_lab_table,2025-11-25
10.1371/journal.pone.0179926,assigning factuality values to semantic relations extracted from biomedical research literature,PLoS ONE,2017.0,no,legacy_lab_table,legacy_lab_table,2025-11-25
10.1371/journal.pone.0174949,an evaluation of mental workload with frontal eeg,PLoS ONE,2017.0,no,legacy_lab_table,legacy_lab_table,2025-11-25
10.1371/journal.pone.0187656,the role of character positional frequency on chinese word learning during natural reading,PLoS ONE,2017.0,no,legacy_lab_table,legacy_lab_table,2025-11-25
10.1371/journal.pone.0183876,are baboons learning orthographic representations probably not,PLoS ONE,2017.0,no,legacy_lab_table,legacy_lab_table,2025-11-25
10.1371/journal.pone.0180441,language related differences of the sustained response evoked by natural speech sounds,PLoS ONE,2017.0,no,legacy_lab_table,legacy_lab_table,2025-11-25
10.1371/journal.pone.0177624,it takes biking to learn physical activity improves learning a second language,PLoS ONE,2017.0,no,legacy_lab_table,legacy_lab_table,2025-11-25
10.1371/journal.pone.0170520,differential processing for actively ignored pictures and words,PLoS ONE,2017.0,no,legacy_lab_table,legacy_lab_table,2025-11-25
10.1371/journal.pone.0181341,netlang a software for the linguistic analysis of corpora by means of complex networks,PLoS ONE,2017.0,no,legacy_lab_table,legacy_lab_table,2025-11-25
10.1371/journal.pone.0165934,why are some languages confused for others investigating data from the great language game,PLoS ONE,2017.0,no,legacy_lab_table,legacy_lab_table,2025-11-25
10.1371/journal.pone.0171626,the acute mania of king george iii a computational linguistic analysis,PLoS ONE,2017.0,no,legacy_lab_table,legacy_lab_table,2025-11-25
10.1371/journal.pone.0187204,authorship attribution of source code by using back propagation neural network based on particle swarm optimization,PLoS ONE,2017.0,no,legacy_lab_table,legacy_lab_table,2025-11-25
10.1371/journal.pone.0178735,writing in the air a visualization tool for written languages,PLoS ONE,2017.0,no,legacy_lab_table,legacy_lab_table,2025-11-25
10.1371/journal.pone.0179004,contextual diversity facilitates learning new words in the classroom,PLoS ONE,2017.0,no,legacy_lab_table,legacy_lab_table,2025-11-25
10.1371/journal.pone.0181987,unzipping zipfs law,PLoS ONE,2017.0,no,legacy_lab_table,legacy_lab_table,2025-11-25
10.1371/journal.pone.0180539,enriching plausible new hypothesis generation in pubmed,PLoS ONE,2017.0,no,legacy_lab_table,legacy_lab_table,2025-11-25
10.1371/journal.pone.0173526,evaluating association between linguistic characteristics of abstracts and risk of bias case of japanese randomized controlled trials,PLoS ONE,2017.0,no,legacy_lab_table,legacy_lab_table,2025-11-25
10.1371/journal.pone.0169143,the appropriateness of language found in research consent form templates a computational linguistic analysis,PLoS ONE,2017.0,no,legacy_lab_table,legacy_lab_table,2025-11-25
10.1371/journal.pone.0189579,vector similarity measures of hesitant fuzzy linguistic term sets and their applications,PLoS ONE,2017.0,no,legacy_lab_table,legacy_lab_table,2025-11-25
10.1371/journal.pone.0180908,beastling a software tool for linguistic phylogenetics using beast 2,PLoS ONE,2017.0,no,legacy_lab_table,legacy_lab_table,2025-11-25
