doi,title,journal,year,decision,source,decision_source,last_updated
10.1371/journal.pone.0171354,optical measurements of paintings and the creation of an artwork database for authenticity,PLoS ONE,2017.0,no,legacy_lab_table,legacy_lab_table,2025-11-25
10.1371/journal.pone.0173755,color adaptation induced from linguistic description of color,PLoS ONE,2017.0,no,legacy_lab_table,legacy_lab_table,2025-11-25
10.1371/journal.pone.0183593,talking to fewer people leads to having more malleable linguistic representations,PLoS ONE,2017.0,no,legacy_lab_table,legacy_lab_table,2025-11-25
10.1371/journal.pone.0180727,early positivity signals changes in an abstract linguistic pattern,PLoS ONE,2017.0,no,legacy_lab_table,legacy_lab_table,2025-11-25
10.1371/journal.pone.0170046,the potential of automatic word comparison for historical linguistics,PLoS ONE,2017.0,no,legacy_lab_table,legacy_lab_table,2025-11-25
10.1371/journal.pone.0175722,unidentifiable by morphology dna barcoding of plant material in local markets in iran,PLoS ONE,2017.0,no,legacy_lab_table,legacy_lab_table,2025-11-25
10.1371/journal.pone.0168344,rumor detection over varying time windows,PLoS ONE,2017.0,no,legacy_lab_table,legacy_lab_table,2025-11-25
10.1371/journal.pone.0183537,predicting age groups of twitter users based on language and metadata features,PLoS ONE,2017.0,no,legacy_lab_table,legacy_lab_table,2025-11-25
10.1371/journal.pone.0182159,verbal monitoring in parkinsons disease a comparison between internal and external monitoring,PLoS ONE,2017.0,no,legacy_lab_table,legacy_lab_table,2025-11-25
10.1371/journal.pone.0185047,mathematical values in the processing of chinese numeral classifiers and measure words,PLoS ONE,2017.0,no,legacy_lab_table,legacy_lab_table,2025-11-25
10.1371/journal.pone.0189919,grammatical verb aspect and event roles in sentence processing,PLoS ONE,2017.0,no,legacy_lab_table,legacy_lab_table,2025-11-25
10.1371/journal.pone.0187854,comparison of ancient and modern chinese based on complex weighted networks,PLoS ONE,2017.0,no,legacy_lab_table,legacy_lab_table,2025-11-25
10.1371/journal.pone.0185578,beyond funding acknowledgement patterns in biomedical natural and social sciences,PLoS ONE,2017.0,no,legacy_lab_table,legacy_lab_table,2025-11-25
10.1371/journal.pone.0185576,perceptual category learning of photographic and painterly stimuli in rhesus macaques macaca mulatta and humans,PLoS ONE,2017.0,no,legacy_lab_table,legacy_lab_table,2025-11-25
10.1371/journal.pone.0175277,constructing a biodiversity terminological inventory,PLoS ONE,2017.0,no,legacy_lab_table,legacy_lab_table,2025-11-25
10.1371/journal.pone.0170845,core executive functions are associated with success in young elite soccer players,PLoS ONE,2017.0,no,legacy_lab_table,legacy_lab_table,2025-11-25
10.1371/journal.pone.0186836,social media analysis during political turbulence,PLoS ONE,2017.0,no,legacy_lab_table,legacy_lab_table,2025-11-25
10.1371/journal.pone.0181850,single neuron recordings of bilinguals performing in a continuous recognition memory task,PLoS ONE,2017.0,no,legacy_lab_table,legacy_lab_table,2025-11-25
10.1371/journal.pone.0182151,embodied conversational agents for multimodal automated social skills training in people with autism spectrum disorders,PLoS ONE,2017.0,no,legacy_lab_table,legacy_lab_table,2025-11-25
10.1371/journal.pone.0181854,apology in cases of medical error disclosure thoughts based on a preliminary study,PLoS ONE,2017.0,no,legacy_lab_table,legacy_lab_table,2025-11-25
10.1371/journal.pone.0181935,y chromosomal evidence on the origin of northern thai people,PLoS ONE,2017.0,no,legacy_lab_table,legacy_lab_table,2025-11-25
10.1371/journal.pone.0180598,convergence between parent report and direct assessment of language and attention in culturally and linguistically diverse children,PLoS ONE,2017.0,no,legacy_lab_table,legacy_lab_table,2025-11-25
10.1371/journal.pone.0177676,experience with speech sounds is not necessary for cue trading by budgerigars melopsittacus undulatus,PLoS ONE,2017.0,no,legacy_lab_table,legacy_lab_table,2025-11-25
10.1371/journal.pone.0175043,facial shape differences between rats selected for tame and aggressive behaviors,PLoS ONE,2017.0,no,legacy_lab_table,legacy_lab_table,2025-11-25
10.1371/journal.pone.0183414,the loss and recovery of vertebrate vision examined in microplates,PLoS ONE,2017.0,no,legacy_lab_table,legacy_lab_table,2025-11-25
10.1371/journal.pone.0181523,development of the korean adult reading test kart to estimate premorbid intelligence in dementia patients,PLoS ONE,2017.0,no,legacy_lab_table,legacy_lab_table,2025-11-25
10.1371/journal.pone.0150771,population size predicts lexical diversity but so does the mean sea level why it is important to correctly account for the structure of temporal data,PLoS ONE,2016.0,no,legacy_lab_table,legacy_lab_table,2025-11-25
10.1371/journal.pone.0146359,lexical planning in sentence production is highly incremental evidence from erps,PLoS ONE,2016.0,no,legacy_lab_table,legacy_lab_table,2025-11-25
10.1371/journal.pone.0147924,semantic factors predict the rate of lexical replacement of content words,PLoS ONE,2016.0,no,legacy_lab_table,legacy_lab_table,2025-11-25
10.1371/journal.pone.0148332,effect of subliminal lexical priming on the subjective perception of images a machine learning approach,PLoS ONE,2016.0,no,legacy_lab_table,legacy_lab_table,2025-11-25
10.1371/journal.pone.0161404,deep brain stimulation of the subthalamic nucleus improves lexical switching in parkinsons disease patients,PLoS ONE,2016.0,no,legacy_lab_table,legacy_lab_table,2025-11-25
10.1371/journal.pone.0159835,the neural substrates underlying the implementation of phonological rule in lexical tone production an fmri study of the tone 3 sandhi phenomenon in mandarin chinese,PLoS ONE,2016.0,no,legacy_lab_table,legacy_lab_table,2025-11-25
10.1371/journal.pone.0167194,erp response unveils effect of second language manipulation on first language processing,PLoS ONE,2016.0,no,legacy_lab_table,legacy_lab_table,2025-11-25
10.1371/journal.pone.0168971,model of the dynamic construction process of texts and scaling laws of words organization in language systems,PLoS ONE,2016.0,no,legacy_lab_table,legacy_lab_table,2025-11-25
10.1371/journal.pone.0157141,exploring the measurement of markedness and its relationship with other linguistic variables,PLoS ONE,2016.0,no,legacy_lab_table,legacy_lab_table,2025-11-25
10.1371/journal.pone.0148707,the brain network of naming a lesson from primary progressive aphasia,PLoS ONE,2016.0,no,legacy_lab_table,legacy_lab_table,2025-11-25
10.1371/journal.pone.0149355,does temporal integration occur for unrecognizable words in visual crowding,PLoS ONE,2016.0,no,legacy_lab_table,legacy_lab_table,2025-11-25
10.1371/journal.pone.0166439,computerized analysis of verbal fluency normative data and the effects of repeated testing simulated malingering and traumatic brain injury,PLoS ONE,2016.0,no,legacy_lab_table,legacy_lab_table,2025-11-25
10.1371/journal.pone.0156482,its harder to break a relationship when you commit long,PLoS ONE,2016.0,no,legacy_lab_table,legacy_lab_table,2025-11-25
10.1371/journal.pone.0151107,from grapheme to phonological output performance of adults who stutter on a word jumble task,PLoS ONE,2016.0,no,legacy_lab_table,legacy_lab_table,2025-11-25
10.1371/journal.pone.0162176,what homophones say about words,PLoS ONE,2016.0,no,legacy_lab_table,legacy_lab_table,2025-11-25
10.1371/journal.pone.0165882,action priority early neurophysiological interaction of conceptual and motor representations,PLoS ONE,2016.0,no,legacy_lab_table,legacy_lab_table,2025-11-25
10.1371/journal.pone.0143060,crowdsourcing language change with smartphone applications,PLoS ONE,2016.0,no,legacy_lab_table,legacy_lab_table,2025-11-25
10.1371/journal.pone.0165534,shape representation of word was automatically activated in the encoding phase,PLoS ONE,2016.0,no,legacy_lab_table,legacy_lab_table,2025-11-25
10.1371/journal.pone.0148492,exploiting publication contents and collaboration networks for collaborator recommendation,PLoS ONE,2016.0,no,legacy_lab_table,legacy_lab_table,2025-11-25
10.1371/journal.pone.0163200,understanding karma police the perceived plausibility of noun compounds as predicted by distributional models of semantic representation,PLoS ONE,2016.0,no,legacy_lab_table,legacy_lab_table,2025-11-25
10.1371/journal.pone.0160147,event recognition based on deep learning in chinese texts,PLoS ONE,2016.0,no,legacy_lab_table,legacy_lab_table,2025-11-25
10.1371/journal.pone.0153686,a moist crevice for word aversion in semantics not sounds,PLoS ONE,2016.0,no,legacy_lab_table,legacy_lab_table,2025-11-25
10.1371/journal.pone.0149933,modulatory effects of attention on lateral inhibition in the human auditory cortex,PLoS ONE,2016.0,no,legacy_lab_table,legacy_lab_table,2025-11-25
10.1371/journal.pone.0146194,the frequency of rapid pupil dilations as a measure of linguistic processing difficulty,PLoS ONE,2016.0,no,legacy_lab_table,legacy_lab_table,2025-11-25
10.1371/journal.pone.0146813,anticipatory posturing of the vocal tract reveals dissociation of speech movement plans from linguistic units,PLoS ONE,2016.0,no,legacy_lab_table,legacy_lab_table,2025-11-25
10.1371/journal.pone.0162092,integrating soft set theory and fuzzy linguistic model to evaluate the performance of training simulation systems,PLoS ONE,2016.0,no,legacy_lab_table,legacy_lab_table,2025-11-25
10.1371/journal.pone.0152489,does sleep improve your grammar preferential consolidation of arbitrary components of new linguistic knowledge,PLoS ONE,2016.0,no,legacy_lab_table,legacy_lab_table,2025-11-25
10.1371/journal.pone.0156597,sampling assumptions affect use of indirect negative evidence in language learning,PLoS ONE,2016.0,no,legacy_lab_table,legacy_lab_table,2025-11-25
10.1371/journal.pone.0165029,multiple language use influences oculomotor task performance neurophysiological evidence of a shared substrate between language and motor control,PLoS ONE,2016.0,no,legacy_lab_table,legacy_lab_table,2025-11-25
10.1371/journal.pone.0161794,let the avatar brighten your smile effects of enhancing facial expressions in virtual environments,PLoS ONE,2016.0,no,legacy_lab_table,legacy_lab_table,2025-11-25
10.1371/journal.pone.0155845,not all flavor expertise is equal the language of wine and coffee experts,PLoS ONE,2016.0,no,legacy_lab_table,legacy_lab_table,2025-11-25
10.1371/journal.pone.0157143,diminished auditory responses during nrem sleep correlate with the hierarchy of language processing,PLoS ONE,2016.0,no,legacy_lab_table,legacy_lab_table,2025-11-25
10.1371/journal.pone.0156855,second language ability and emotional prosody perception,PLoS ONE,2016.0,no,legacy_lab_table,legacy_lab_table,2025-11-25
10.1371/journal.pone.0152979,shared cultural history as a predictor of political and economic changes among nation states,PLoS ONE,2016.0,no,legacy_lab_table,legacy_lab_table,2025-11-25
10.1371/journal.pone.0151138,languages support efficient communication about the environment words for snow revisited,PLoS ONE,2016.0,no,legacy_lab_table,legacy_lab_table,2025-11-25
10.1371/journal.pone.0163141,are categorical spatial relations encoded by shifting visual attention between objects,PLoS ONE,2016.0,no,legacy_lab_table,legacy_lab_table,2025-11-25
10.1371/journal.pone.0151570,the evolution of musical diversity the key role of vertical transmission,PLoS ONE,2016.0,no,legacy_lab_table,legacy_lab_table,2025-11-25
10.1371/journal.pone.0147734,compositional reasoning in early childhood,PLoS ONE,2016.0,no,legacy_lab_table,legacy_lab_table,2025-11-25
10.1371/journal.pone.0150365,speech databases of typical children and children with sli,PLoS ONE,2016.0,no,legacy_lab_table,legacy_lab_table,2025-11-25
10.1371/journal.pone.0168571,can you play with fire and not hurt yourself a comparative study in figurative language comprehension between individuals with and without autism spectrum disorder,PLoS ONE,2016.0,no,legacy_lab_table,legacy_lab_table,2025-11-25
10.1371/journal.pone.0164448,can learning a foreign language foster analytic thinkingevidence from chinese efl learners writings,PLoS ONE,2016.0,no,legacy_lab_table,legacy_lab_table,2025-11-25
10.1371/journal.pone.0164414,outlining the ancestry landscape of colombian admixed populations,PLoS ONE,2016.0,no,legacy_lab_table,legacy_lab_table,2025-11-25
10.1371/journal.pone.0164184,positive vs negative the impact of question polarity in voting advice applications,PLoS ONE,2016.0,no,legacy_lab_table,legacy_lab_table,2025-11-25
10.1371/journal.pone.0158446,the electrophysiology of basic phrase building,PLoS ONE,2016.0,no,legacy_lab_table,legacy_lab_table,2025-11-25
10.1371/journal.pone.0161018,a reassessment of the impact of european contact on the structure of native american genetic diversity,PLoS ONE,2016.0,no,legacy_lab_table,legacy_lab_table,2025-11-25
10.1371/journal.pone.0157947,evaluating the validity of simplified chinese version of liwc in detecting psychological expressions in short texts on social network services,PLoS ONE,2016.0,no,legacy_lab_table,legacy_lab_table,2025-11-25
10.1371/journal.pone.0157936,the typicality ranking task a new method to derive typicality judgments from children,PLoS ONE,2016.0,no,legacy_lab_table,legacy_lab_table,2025-11-25
10.1371/journal.pone.0155964,symbolic play and novel noun learning in deaf and hearing children longitudinal effects of access to sound on early precursors of language,PLoS ONE,2016.0,no,legacy_lab_table,legacy_lab_table,2025-11-25
10.1371/journal.pone.0155885,women are warmer but no less assertive than men gender and language on facebook,PLoS ONE,2016.0,no,legacy_lab_table,legacy_lab_table,2025-11-25
10.1371/journal.pone.0153222,an integrated mcdm model for conveyor equipment evaluation and selection in an fmc based on a fuzzy ahp and fuzzy aras in the presence of vagueness,PLoS ONE,2016.0,no,legacy_lab_table,legacy_lab_table,2025-11-25
10.1371/journal.pone.0150881,life satisfaction and the pursuit of happiness on twitter,PLoS ONE,2016.0,no,legacy_lab_table,legacy_lab_table,2025-11-25
10.1371/journal.pone.0147573,profiling speech and pausing in amyotrophic lateral sclerosis als and frontotemporal dementia ftd,PLoS ONE,2016.0,no,legacy_lab_table,legacy_lab_table,2025-11-25
10.1371/journal.pone.0157069,a method for quantifying visualising and analysing gastropod shell form,PLoS ONE,2016.0,no,legacy_lab_table,legacy_lab_table,2025-11-25
10.1371/journal.pone.0153603,association of dcdc2 polymorphisms with normal variations in reading abilities in a chinese population,PLoS ONE,2016.0,no,legacy_lab_table,legacy_lab_table,2025-11-25
10.1371/journal.pone.0166989,variability of rheotaxis behaviors in larval bullfrogs highlights species diversity in lateral line function,PLoS ONE,2016.0,no,legacy_lab_table,legacy_lab_table,2025-11-25
10.1371/journal.pone.0155305,understanding editing behaviors in multilingual wikipedia,PLoS ONE,2016.0,no,legacy_lab_table,legacy_lab_table,2025-11-25
10.1371/journal.pone.0145926,simultaneity and temporal order judgments exhibit distinct reaction times and training effects,PLoS ONE,2016.0,no,legacy_lab_table,legacy_lab_table,2025-11-25
10.1371/journal.pone.0157988,a novel clustering methodology based on modularity optimisation for detecting authorship affinities in shakespearean era plays,PLoS ONE,2016.0,no,legacy_lab_table,legacy_lab_table,2025-11-25
10.1371/journal.pone.0150497,schoolbook texts behavioral achievement priming in math and language,PLoS ONE,2016.0,no,legacy_lab_table,legacy_lab_table,2025-11-25
10.1111/josl.12214,fighting words joning as conflict talk and identity performance among african american preadolescents,Journal of Sociolinguistics,2016.0,no,legacy_lab_table,legacy_lab_table,2025-11-25
10.1016/j.newideapsych.2015.07.009,on agency in situated languaging participatory agency and competing approaches,New Ideas in Psychology,2016.0,no,legacy_lab_table,legacy_lab_table,2025-11-25
10.3109/02699206.2014.999952,norwegian words a lexical database for clinicians and researchers,Clinical Linguistics & Phonetics,2015.0,yes,legacy_lab_table,legacy_lab_table,2025-11-25
10.1080/17470218.2014.964271,on the advantages of word frequency and contextual diversity measures extracted from subtitles the case of portuguese,The Quarterly Journal of Experimental Psychology,2015.0,yes,legacy_lab_table,legacy_lab_table,2025-11-25
10.1515/ling-2015-0005,predicting mutual intelligibility of chinese dialects from multiple objective linguistic distance measures,Linguistics,2015.0,no,legacy_lab_table,legacy_lab_table,2025-11-25
10.1371/journal.pone.0116950,towards a formal genealogical classification of the lezgian languages north caucasus testing various phylogenetic methods on lexical data,PLoS ONE,2015.0,no,legacy_lab_table,legacy_lab_table,2025-11-25
10.1371/journal.pone.0129710,the role of temporal envelope and fine structure in mandarin lexical tone perception in auditory neuropathy spectrum disorder,PLoS ONE,2015.0,no,legacy_lab_table,legacy_lab_table,2025-11-25
10.1371/journal.pone.0123254,modeling the lexical morphology of western handwritten signatures,PLoS ONE,2015.0,no,legacy_lab_table,legacy_lab_table,2025-11-25
10.1371/journal.pone.0116193,tracking second thoughts continuous and discrete revision processes during visual lexical decision,PLoS ONE,2015.0,no,legacy_lab_table,legacy_lab_table,2025-11-25
10.1371/journal.pone.0133446,distributional learning of lexical tones a comparison of attended vs unattended listening,PLoS ONE,2015.0,no,legacy_lab_table,legacy_lab_table,2025-11-25
10.1371/journal.pone.0124388,language differences in the brain network for reading in naturalistic story reading and lexical decision,PLoS ONE,2015.0,no,legacy_lab_table,legacy_lab_table,2025-11-25
10.1371/journal.pone.0143968,stress deafness reveals absence of lexical marking of stress or tone in the adult grammar,PLoS ONE,2015.0,no,legacy_lab_table,legacy_lab_table,2025-11-25
10.1371/journal.pone.0143097,representation and processing of lexical tone and tonal variants evidence from the mismatch negativity,PLoS ONE,2015.0,no,legacy_lab_table,legacy_lab_table,2025-11-25
10.1371/journal.pone.0124470,phonological codes constrain output of orthographic codes via sublexical and lexical routes in chinese written production,PLoS ONE,2015.0,no,legacy_lab_table,legacy_lab_table,2025-11-25
10.1371/journal.pone.0137147,iconicity in english and spanish and its relation to lexical category and age of acquisition,PLoS ONE,2015.0,no,legacy_lab_table,legacy_lab_table,2025-11-25
10.1371/journal.pone.0138567,how does word length evolve in written chinese,PLoS ONE,2015.0,no,legacy_lab_table,legacy_lab_table,2025-11-25
10.1371/journal.pone.0126809,whats in a name sound symbolism and gender in first names,PLoS ONE,2015.0,no,legacy_lab_table,legacy_lab_table,2025-11-25
10.1371/journal.pone.0136277,a complex network approach to distributional semantic models,PLoS ONE,2015.0,no,legacy_lab_table,legacy_lab_table,2025-11-25
10.1371/journal.pone.0134335,spatial structure of evolutionary models of dialects in contact,PLoS ONE,2015.0,no,legacy_lab_table,legacy_lab_table,2025-11-25
10.1371/journal.pone.0144576,when feelings arise with meanings how emotion and meaning of a native language affect second language processing in adult learners,PLoS ONE,2015.0,no,legacy_lab_table,legacy_lab_table,2025-11-25
10.1371/journal.pone.0142060,the contributions of segmental and suprasegmental information in reading chinese characters aloud,PLoS ONE,2015.0,no,legacy_lab_table,legacy_lab_table,2025-11-25
10.1371/journal.pone.0142281,modeling coevolution between language and memory capacity during language origin,PLoS ONE,2015.0,no,legacy_lab_table,legacy_lab_table,2025-11-25
10.1371/journal.pone.0134008,eye movement patterns in natural reading a comparison of monolingual and bilingual reading of a novel,PLoS ONE,2015.0,no,legacy_lab_table,legacy_lab_table,2025-11-25
10.1371/journal.pone.0119091,assessing the impact of case sensitivity and term information gain on biomedical concept recognition,PLoS ONE,2015.0,no,legacy_lab_table,legacy_lab_table,2025-11-25
10.1371/journal.pone.0119611,syntactic priming in american sign language,PLoS ONE,2015.0,no,legacy_lab_table,legacy_lab_table,2025-11-25
10.1371/journal.pone.0144788,auditory streaming as an online classification process with evidence accumulation,PLoS ONE,2015.0,no,legacy_lab_table,legacy_lab_table,2025-11-25
10.1371/journal.pone.0141563,transnewguineaorg an online database of new guinea languages,PLoS ONE,2015.0,no,legacy_lab_table,legacy_lab_table,2025-11-25
10.1371/journal.pone.0119758,new genetic and linguistic analyses show ancient human influence on baobab evolution and distribution in australia,PLoS ONE,2015.0,no,legacy_lab_table,legacy_lab_table,2025-11-25
10.1371/journal.pone.0126897,ethiopian population dermatoglyphic study reveals linguistic stratification of diversity,PLoS ONE,2015.0,no,legacy_lab_table,legacy_lab_table,2025-11-25
10.1371/journal.pone.0118437,incorporating linguistic knowledge for learning distributed word representations,PLoS ONE,2015.0,no,legacy_lab_table,legacy_lab_table,2025-11-25
10.1371/journal.pone.0121434,oscillatory brain activity reveals linguistic prints in the quantity code,PLoS ONE,2015.0,no,legacy_lab_table,legacy_lab_table,2025-11-25
10.1371/journal.pone.0113475,the effect of perceived regional accents on individual economic behavior a lab experiment on linguistic performance cognitive ratings and economic decisions,PLoS ONE,2015.0,no,legacy_lab_table,legacy_lab_table,2025-11-25
10.1371/journal.pone.0133599,an integrated approach of fuzzy linguistic preference based ahp and fuzzy copras for machine tool evaluation,PLoS ONE,2015.0,no,legacy_lab_table,legacy_lab_table,2025-11-25
10.1371/journal.pone.0144016,the brazilian portuguese lexicon an instrument for psycholinguistic research,PLoS ONE,2015.0,no,legacy_lab_table,legacy_lab_table,2025-11-25
10.1371/journal.pone.0125019,individual biases cultural evolution and the statistical nature of language universals the case of colour naming systems,PLoS ONE,2015.0,no,legacy_lab_table,legacy_lab_table,2025-11-25
10.1371/journal.pone.0133902,introducing risc a new video inventory for testing social perception,PLoS ONE,2015.0,no,legacy_lab_table,legacy_lab_table,2025-11-25
10.1371/journal.pone.0120240,ethnopedology in the study of toponyms connected to the indigenous knowledge on soil resource,PLoS ONE,2015.0,no,legacy_lab_table,legacy_lab_table,2025-11-25
10.1371/journal.pone.0115758,visual attention during spatial language comprehension,PLoS ONE,2015.0,no,legacy_lab_table,legacy_lab_table,2025-11-25
10.1371/journal.pone.0139610,fingerspelling as a novel gateway into reading fluency in deaf bilinguals,PLoS ONE,2015.0,no,legacy_lab_table,legacy_lab_table,2025-11-25
10.1371/journal.pone.0128448,a sketch of language history in the korean peninsula,PLoS ONE,2015.0,no,legacy_lab_table,legacy_lab_table,2025-11-25
10.1371/journal.pone.0121472,footprints of middle ages kingdoms are still visible in the contemporary surname structure of spain,PLoS ONE,2015.0,no,legacy_lab_table,legacy_lab_table,2025-11-25
10.1371/journal.pone.0114615,naming a lego world the role of language in the acquisition of abstract concepts,PLoS ONE,2015.0,no,legacy_lab_table,legacy_lab_table,2025-11-25
10.1371/journal.pone.0116040,generation of silver standard concept annotations from biomedical texts with special relevance to phenotypes,PLoS ONE,2015.0,no,legacy_lab_table,legacy_lab_table,2025-11-25
10.1371/journal.pone.0145431,patient safety in medication nomenclature orthographic and semantic properties of international nonproprietary names,PLoS ONE,2015.0,no,legacy_lab_table,legacy_lab_table,2025-11-25
10.1371/journal.pone.0138481,the dilution effect and information integration in perceptual decision making,PLoS ONE,2015.0,no,legacy_lab_table,legacy_lab_table,2025-11-25
10.1371/journal.pone.0117426,the collective benefits of feeling good and letting go positive emotion and disinhibition interact to predict cooperative behavior,PLoS ONE,2015.0,no,legacy_lab_table,legacy_lab_table,2025-11-25
10.1371/journal.pone.0144643,emerging heterogeneities in italian customs and comparison with nearby countries,PLoS ONE,2015.0,no,legacy_lab_table,legacy_lab_table,2025-11-25
10.1371/journal.pone.0145030,inhibitory control predicts grammatical ability,PLoS ONE,2015.0,no,legacy_lab_table,legacy_lab_table,2025-11-25
10.1371/journal.pone.0142651,narrative length and speech rate in battered women,PLoS ONE,2015.0,no,legacy_lab_table,legacy_lab_table,2025-11-25
10.1371/journal.pone.0141069,music and language syntax interact in brocas area an fmri study,PLoS ONE,2015.0,no,legacy_lab_table,legacy_lab_table,2025-11-25
10.1371/journal.pone.0141181,understanding how grammatical aspect influences legal judgment,PLoS ONE,2015.0,no,legacy_lab_table,legacy_lab_table,2025-11-25
10.1371/journal.pone.0140160,hemispheric asymmetries in repetition enhancement and suppression effects in the newborn brain,PLoS ONE,2015.0,no,legacy_lab_table,legacy_lab_table,2025-11-25
10.1371/journal.pone.0138090,early south americans cranial morphological variation and the origin of american biological diversity,PLoS ONE,2015.0,no,legacy_lab_table,legacy_lab_table,2025-11-25
10.1371/journal.pone.0138877,emotional meaning in context in relation to hypomanic personality traits an erp study,PLoS ONE,2015.0,no,legacy_lab_table,legacy_lab_table,2025-11-25
10.1371/journal.pone.0136100,universal principles in the repair of communication problems,PLoS ONE,2015.0,no,legacy_lab_table,legacy_lab_table,2025-11-25
10.1371/journal.pone.0137557,the role of sustained attention in the production of conjoined noun phrases an individual differences study,PLoS ONE,2015.0,no,legacy_lab_table,legacy_lab_table,2025-11-25
